inventory_id,description,manufacturer_code,brand_name,retail_price,store_sku,department,qty_on_hand,warehouse,last_received
RET_001147,Tripp Lite TRI81707 Tripod 60-inch Aluminum,TRI-001147,Tripp Lite,3271.53,R-021709,Office,8,WH-SOUTH,2024-04-16T00:00:00
RET_003704,Plugable PLU337407 Power Strip 8-Outlet USB,PLU-003704,Plugable,2729.59,R-035117,Office,5,WH-SOUTH,2024-10-05T00:00:00
RET_003128,Targus TAR279807 Webcam Cover Slide 3-Pack,TAR-003128,Targus,1822.11,R-078527,Electronics,98,WH-CENTRAL,2025-04-27T00:00:00
RET_001961,Cable Matters CAB163107 Adapter USB-C to USB-A,CAB-001961,Cable Matters,626.54,R-078911,Gaming,179,WH-NORTH,2025-02-27T00:00:00
RET_001056,CalDigit CAL72607 MicroSD Card 256GB,CAL-001056,CalDigit,465.63,R-013082,Gaming,54,WH-NORTH,2025-07-14T00:00:00
RET_001715,INIU INI138507 Hub USB 3.0 4-Port,INI-001715,INIU,832.15,R-026302,Appliances,158,WH-CENTRAL,2025-06-07T00:00:00
RET_000425,OtterBox OTT9507 Gimbal Smartphone 3-Axis,OTT-000425,OtterBox,2629.75,R-021699,Appliances,48,WH-CENTRAL,2024-10-17T00:00:00
RET_003335,Satechi SAT300507 SD Card 256GB,SAT-003335,Satechi,3524.34,R-044023,Audio,120,WH-SOUTH,2024-05-07T00:00:00
RET_002909,MONOPRICE MON257907 Phone Case Rugged,MON-002909,Monoprice,3660.73,R-058312,Networking,176,WH-CENTRAL,2024-01-27T00:00:00
RET_001899,PNY PNY156907 SD Card 128GB,PNY-001899,PNY,2317.83,R-093621,Audio,128,WH-EAST,2024-05-22T00:00:00
RET_003649,Belkin BEL331907 Banana Plug Connector 4-Pack,BEL-003649,Belkin,2094.13,R-035440,Appliances,107,WH-CENTRAL,2024-03-22T00:00:00
RET_000307,NZXT C1200 Gold 1200W PSU,NZX-000307,NZXT,705.10,R-034328,Audio,7,WH-NORTH,2025-01-03T00:00:00
RET_002693,Mophie MOP236307 Tripod 60-inch Aluminum,MOP-002693,Mophie,1299.98,R-071807,Computing,49,WH-CENTRAL,2025-06-08T00:00:00
RET_000234,Razer Basilisk V3 Pro Mouse,RAZ-000234,Razer,616.28,R-079338,Storage,185,WH-NORTH,2025-05-01T00:00:00
RET_003434,JETech JET310407 Wireless Charger Stand 20W,JET-003434,JETech,1670.00,R-079582,Office,153,WH-NORTH,2025-06-07T00:00:00
RET_001501,Monoprice MON117107 Wireless Charger Pad 15W,MON-001501,Monoprice,692.05,R-044134,Audio,152,WH-CENTRAL,2024-02-03T00:00:00
RET_002892,Targus TAR256207 Monitor Arm Dual,TAR-002892,Targus,2704.82,R-010928,Appliances,49,WH-CENTRAL,2024-01-03T00:00:00
RET_001747,HyperDrive HYP141707 Headphone Stand Wood,HYP-001747,HyperDrive,1641.44,R-076149,Smart Home,12,WH-SOUTH,2025-08-05T00:00:00
RET_001138,Mophie MOP80807 Stylus Pen iPad,MOP-001138,Mophie,33.34,R-014872,Computing,76,WH-NORTH,2024-09-11T00:00:00
RET_002176,Targus TAR184607 Laptop Stand Adjustable,TAR-002176,Targus,19.07,R-036613,Office,110,WH-WEST,2024-05-01T00:00:00
RET_003089,HyperDrive HYP275907 Bluetooth Audio Transmitter,HYP-003089,HyperDrive,2405.30,R-074133,Computing,89,WH-EAST,2025-05-29T00:00:00
RET_001365,JETech JET103507 Cable Management Box Small,JET-001365,JETech,3653.87,R-060144,Audio,130,WH-EAST,2025-05-24T00:00:00
RET_000453,UGREEN UGR12307 Adapter USB-C to HDMI,UGR-000453,UGREEN,1422.59,R-066555,Photography,6,WH-WEST,2024-12-10T00:00:00
RET_000912,StarTech STA58207 Rechargeable Battery Kit,STA-000912,StarTech,2774.81,R-037163,Gaming,176,WH-NORTH,2024-06-25T00:00:00
RET_001171,Spigen SPI84107 Wireless Charger Stand 20W,SPI-001171,Spigen,328.46,R-066459,Computing,27,WH-NORTH,2024-12-06T00:00:00
RET_003394,Targus TAR306407 USB Flash Drive 128GB,TAR-003394,Targus,2124.00,R-057914,Electronics,105,WH-EAST,2025-07-25T00:00:00
RET_002177,Baseus BAS184707 Microphone Pop Filter,BAS-002177,Baseus,3221.43,R-038035,Electronics,62,WH-SOUTH,2024-11-27T00:00:00
RET_001674,Targus TAR134407 Tablet Case Folio,TAR-001674,Targus,2491.64,R-055993,Office,14,WH-SOUTH,2024-11-20T00:00:00
RET_000068,HP Spectre x360 14 i7 16GB,HP-000068,HP,1416.16,R-093267,Appliances,31,WH-SOUTH,2025-06-25T00:00:00
RET_002760,JETech JET243007 Wrist Rest Keyboard,JET-002760,JETech,475.48,R-020426,Photography,10,WH-CENTRAL,2024-12-23T00:00:00
RET_000478,JSAUX JSA14807 Wireless Charger Pad 15W,JSA-000478,JSAUX,2498.59,R-089050,Photography,3,WH-SOUTH,2025-02-13T00:00:00
RET_001558,Satechi SAT122807 Hard Drive Case Shockproof,SAT-001558,Satechi,3800.72,R-078224,Smart Home,84,WH-EAST,2024-05-04T00:00:00
RET_001110,Satechi SAT78007 Bluetooth Receiver,SAT-001110,Satechi,2749.71,R-067860,Appliances,60,WH-WEST,2024-05-31T00:00:00
RET_000882,JSAUX JSA55207 Optical Audio Cable 6ft,JSA-000882,JSAUX,2403.39,R-047029,Networking,32,WH-CENTRAL,2024-07-15T00:00:00
RET_000341,Nillkin NIL1107 Power Strip 8-Outlet USB,NIL-000341,Nillkin,2383.95,R-089922,Computing,109,WH-CENTRAL,2025-03-28T00:00:00
RET_002041,Targus TAR171107 SD Card 128GB,TAR-002041,Targus,3032.14,R-046709,Smart Home,58,WH-WEST,2025-03-29T00:00:00
RET_001621,TWELVE SOUTH TWE129107 Ethernet Cat6 Cable 25ft,TWE-001621,Twelve South,2351.19,R-022288,Electronics,135,WH-EAST,2024-09-06T00:00:00
RET_001998,Dynex DYN166807 Compressed Air Duster 2-Pack,DYN-001998,Dynex,1071.66,R-052231,Gaming,172,WH-CENTRAL,2025-01-31T00:00:00
RET_002253,Monoprice MON192307 Battery Pack AAA 12-Pack,MON-002253,Monoprice,3246.40,R-064601,Networking,185,WH-CENTRAL,2024-10-06T00:00:00
RET_000216,Corsair K70 RGB Pro Mechanical Keyboard,COR-000216,Corsair,3456.20,R-076766,Storage,108,WH-SOUTH,2024-12-25T00:00:00
RET_002546,Cable Matters CAB221607 Lightning Cable 3ft,CAB-002546,Cable Matters,1911.32,R-081888,Photography,87,WH-NORTH,2024-04-16T00:00:00
RET_003779,Monoprice MON344907 Keyboard Cover Silicone,MON-003779,Monoprice,555.50,R-076004,Gaming,185,WH-SOUTH,2024-07-04T00:00:00
RET_000135,Logitech C920e HD Pro Webcam,LOG-000135,Logitech,950.73,R-040407,Office,183,WH-NORTH,2025-03-01T00:00:00
RET_000648,INIU INI31807 Hub USB-C 7-in-1,INI-000648,INIU,1966.12,R-090671,Appliances,157,WH-EAST,2024-10-10T00:00:00
RET_002722,StarTech STA239207 Adapter USB-C to HDMI,STA-002722,StarTech,2026.67,R-019470,Networking,18,WH-WEST,2025-06-03T00:00:00
RET_000521,Tripp Lite TRI19107 Banana Plug Connector 4-Pack,TRI-000521,Tripp Lite,3119.26,R-052290,Photography,144,WH-WEST,2025-08-06T00:00:00
RET_002682,Kensington KEN235207 Monitor Stand Riser,KEN-002682,Kensington,3935.06,R-061915,Gaming,37,WH-WEST,2025-02-09T00:00:00
RET_000703,Mophie MOP37307 Lightning Cable 3ft,MOP-000703,Mophie,963.36,R-091291,Computing,148,WH-SOUTH,2024-01-25T00:00:00
RET_000637,AmazonBasics AMA30707 Screen Protector Film,AMA-000637,AmazonBasics,2779.09,R-043124,Computing,5,WH-SOUTH,2024-04-11T00:00:00
RET_002106,DYNEX DYN177607 Microphone Pop Filter,DYN-002106,Dynex,885.64,R-066853,Office,28,WH-WEST,2024-08-28T00:00:00
RET_003127,INIU INI279707 Cable Management Box Large,INI-003127,INIU,3203.42,R-092387,Gaming,139,WH-EAST,2025-05-31T00:00:00
RET_001498,Belkin BEL116807 Hard Drive Case Shockproof,BEL-001498,Belkin,84.95,R-095881,Gaming,156,WH-SOUTH,2024-07-31T00:00:00
RET_002939,ESR ESR260907 Speaker Wire 50ft 14AWG,ESR-002939,ESR,2942.98,R-036054,Storage,37,WH-EAST,2024-08-27T00:00:00
RET_003828,SPIGEN SPI349807 Camera Lens Protector,SPI-003828,Spigen,2280.06,R-080860,Office,176,WH-SOUTH,2025-04-07T00:00:00
RET_000375,JETech JET4507 Privacy Screen 13-inch,JET-000375,JETech,3102.17,R-016736,Storage,153,WH-SOUTH,2024-07-08T00:00:00
RET_001463,ESR ESR113307 USB-C Cable 10ft,ESR-001463,ESR,2708.48,R-027908,Office,1,WH-NORTH,2024-04-17T00:00:00
RET_002231,ESR ESR190107 Keyboard Cover Silicone,ESR-002231,ESR,2235.94,R-078784,Networking,37,WH-CENTRAL,2024-02-18T00:00:00
RET_001697,PNY PNY136707 Bluetooth Receiver,PNY-001697,PNY,1095.85,R-010888,Appliances,167,WH-EAST,2024-10-05T00:00:00
RET_000747,Baseus BAS41707 Headphone Stand Aluminum,BAS-000747,Baseus,274.14,R-044758,Electronics,171,WH-CENTRAL,2024-08-06T00:00:00
RET_003339,Spigen SPI300907 Phone Mount Car Vent,SPI-003339,Spigen,162.00,R-026550,Computing,193,WH-CENTRAL,2024-08-13T00:00:00
RET_000167,Anker Soundcore Liberty 4 NC,ANK-000167,Anker,971.70,R-056849,Storage,75,WH-CENTRAL,2025-07-25T00:00:00
RET_001555,Targus TAR122507 Phone Mount Car Vent,TAR-001555,Targus,399.39,R-052221,Audio,130,WH-NORTH,2024-07-09T00:00:00
RET_002327,Satechi SAT199707 Compressed Air Duster 2-Pack,SAT-002327,Satechi,1576.40,R-013622,Smart Home,152,WH-SOUTH,2024-01-12T00:00:00
RET_001352,Baseus BAS102207 Screen Protector Film,BAS-001352,Baseus,2530.35,R-073767,Office,8,WH-EAST,2024-08-18T00:00:00
RET_002955,OtterBox OTT262507 Surge Protector 12-Outlet,OTT-002955,OtterBox,97.40,R-021237,Audio,176,WH-EAST,2024-10-14T00:00:00
RET_001836,TWELVE SOUTH TWE150607 Webcam Cover Slide 3-Pack,TWE-001836,Twelve South,1649.47,R-062184,Storage,115,WH-CENTRAL,2024-03-05T00:00:00
RET_000059,Dell Ultrasharp U3423WE 34-inch Curved Monitor,DEL-000059,Dell,1969.44,R-021736,Appliances,139,WH-SOUTH,2024-09-15T00:00:00
RET_003637,INIU INI330707 Gimbal Smartphone 3-Axis,INI-003637,INIU,2790.55,R-062038,Storage,193,WH-NORTH,2024-03-20T00:00:00
RET_001650,CalDigit CAL132007 Green Screen Backdrop 5x7ft,CAL-001650,CalDigit,2678.14,R-048143,Computing,166,WH-EAST,2025-03-06T00:00:00
RET_003264,ESR ESR293407 Audio Interface USB-C 2-Channel,ESR-003264,ESR,2434.18,R-072918,Photography,191,WH-EAST,2025-08-04T00:00:00
RET_003793,Monoprice MON346307 Thermal Paste 4g,MON-003793,Monoprice,306.34,R-094447,Storage,38,WH-EAST,2024-11-29T00:00:00
RET_002832,Dynex DYN250207 Phone Mount Car Vent,DYN-002832,Dynex,914.49,R-026372,Office,99,WH-SOUTH,2024-01-03T00:00:00
RET_002291,Targus TAR196107 USB Fan Mini Portable,TAR-002291,Targus,1598.46,R-099123,Gaming,174,WH-WEST,2024-07-26T00:00:00
RET_003513,Sabrent SAB318307 Tripod 60-inch Aluminum,SAB-003513,Sabrent,955.42,R-040261,Computing,109,WH-EAST,2025-08-08T00:00:00
RET_003642,ESR ESR331207 Tripod Mini Tabletop,ESR-003642,ESR,109.09,R-082766,Electronics,3,WH-SOUTH,2024-11-18T00:00:00
RET_000602,TWELVE SOUTH TWE27207 Guitar Cable 20ft,TWE-000602,Twelve South,3935.43,R-047613,Electronics,96,WH-SOUTH,2025-04-24T00:00:00
RET_001547,Nillkin NIL121707 Monitor Arm Single,NIL-001547,Nillkin,220.11,R-023577,Storage,40,WH-SOUTH,2024-07-21T00:00:00
RET_003476,PNY PNY314607 Laptop Sleeve 13-inch,PNY-003476,PNY,634.50,R-076892,Smart Home,164,WH-SOUTH,2024-11-09T00:00:00
RET_001907,Baseus BAS157707 Adapter Lightning to USB-C,BAS-001907,Baseus,1380.07,R-020704,Office,79,WH-SOUTH,2024-09-21T00:00:00
RET_003750,UGREEN UGR342007 Cable Organizer Clips,UGR-003750,UGREEN,51.68,R-034501,Photography,165,WH-CENTRAL,2024-05-09T00:00:00
RET_001643,CalDigit CAL131307 Portable SSD Case,CAL-001643,CalDigit,537.43,R-041619,Electronics,9,WH-WEST,2024-12-20T00:00:00
RET_003162,Insignia INS283207 Phone Case Clear,INS-003162,Insignia,854.18,R-071407,Smart Home,175,WH-CENTRAL,2025-04-16T00:00:00
RET_000853,JSAUX JSA52307 Microphone Pop Filter,JSA-000853,JSAUX,3627.49,R-054632,Gaming,121,WH-CENTRAL,2024-02-21T00:00:00
RET_001141,Targus TAR81107 Hub USB-C 7-in-1,TAR-001141,Targus,793.96,R-060229,Electronics,176,WH-NORTH,2024-07-31T00:00:00
RET_001508,Belkin BEL117807 Anti-Glare Screen Film 27-inch,BEL-001508,Belkin,3020.25,R-076231,Electronics,192,WH-SOUTH,2024-09-27T00:00:00
RET_000133,Logitech MX Mechanical Mini Keyboard,LOG-000133,Logitech,410.22,R-034944,Smart Home,150,WH-EAST,2025-04-27T00:00:00
RET_003125,UGREEN UGR279507 Camera Bag Sling,UGR-003125,UGREEN,648.46,R-071754,Appliances,126,WH-CENTRAL,2024-08-06T00:00:00
RET_001703,Plugable PLU137307 VGA to HDMI Adapter,PLU-001703,Plugable,140.36,R-053649,Office,139,WH-CENTRAL,2025-07-27T00:00:00
RET_000259,Canon EOS R50 Body with 18-45mm Kit,CAN-000259,Canon,683.33,R-033600,Appliances,12,WH-EAST,2025-03-14T00:00:00
RET_003679,Targus TAR334907 Phone Mount Desk,TAR-003679,Targus,3238.55,R-035119,Smart Home,25,WH-NORTH,2024-08-09T00:00:00
RET_000035,Samsung Galaxy Watch 6 Classic 47mm,SAM-000035,Samsung,3099.23,R-034761,Storage,145,WH-CENTRAL,2024-11-02T00:00:00
RET_003042,Twelve South TWE271207 MicroSD Card 256GB,TWE-003042,Twelve South,2501.05,R-024662,Audio,118,WH-WEST,2024-10-26T00:00:00
RET_001865,INIU INI153507 Cable Ties 100-Pack,INI-001865,INIU,3395.92,R-012255,Photography,182,WH-CENTRAL,2025-04-02T00:00:00
RET_001080,DYNEX DYN75007 Desk Lamp LED USB,DYN-001080,Dynex,1880.27,R-096293,Networking,135,WH-EAST,2024-07-10T00:00:00
RET_002494,Plugable PLU216407 Microfiber Cloth 6-Pack,PLU-002494,Plugable,2387.07,R-023833,Gaming,173,WH-NORTH,2025-01-29T00:00:00
RET_001041,Syncwire SYN71107 Wireless Charger Pad 15W,SYN-001041,Syncwire,3455.22,R-075676,Audio,92,WH-WEST,2025-06-30T00:00:00
RET_000974,StarTech STA64407 Cable Ties 100-Pack,STA-000974,StarTech,992.35,R-090924,Storage,55,WH-EAST,2024-11-10T00:00:00
RET_000998,Tripp Lite TRI66807 Ring Light 12-inch Kit,TRI-000998,Tripp Lite,3002.56,R-061543,Photography,101,WH-NORTH,2024-11-07T00:00:00
RET_003563,Kensington KEN323307 USB-C Cable 6ft,KEN-003563,Kensington,1600.03,R-035111,Gaming,163,WH-CENTRAL,2025-04-25T00:00:00
RET_002601,Sabrent SAB227107 Headphone Stand Wood,SAB-002601,Sabrent,3264.26,R-053691,Gaming,21,WH-EAST,2025-05-24T00:00:00
RET_000395,Cable Matters CAB6507 Rechargeable Battery Kit,CAB-000395,Cable Matters,3649.59,R-023685,Computing,172,WH-SOUTH,2025-05-25T00:00:00
RET_003635,Nillkin NIL330507 Lightning Cable 3ft,NIL-003635,Nillkin,3070.31,R-051182,Photography,169,WH-WEST,2025-04-13T00:00:00
RET_000940,Plugable PLU61007 MicroSD Card 256GB,PLU-000940,Plugable,2168.86,R-091749,Electronics,13,WH-SOUTH,2025-06-01T00:00:00
RET_003157,TARGUS TAR282707 Audio Splitter 3.5mm,TAR-003157,Targus,1757.43,R-083827,Audio,66,WH-EAST,2025-02-17T00:00:00
RET_003630,SABRENT SAB330007 Laptop Backpack,SAB-003630,Sabrent,717.96,R-049694,Office,151,WH-EAST,2024-07-24T00:00:00
RET_002723,Spigen SPI239307 HDMI Switch 3x1,SPI-002723,Spigen,3437.45,R-047075,Gaming,80,WH-CENTRAL,2024-12-19T00:00:00
RET_001510,Targus TAR118007 Camera Lens Protector,TAR-001510,Targus,2155.99,R-085047,Networking,192,WH-CENTRAL,2025-01-17T00:00:00
RET_001449,UGREEN UGR111907 Gimbal Smartphone 3-Axis,UGR-001449,UGREEN,930.96,R-045243,Electronics,7,WH-NORTH,2025-06-01T00:00:00
RET_000601,Twelve South TWE27107 Laptop Sleeve 15-inch,TWE-000601,Twelve South,2086.19,R-046435,Computing,113,WH-NORTH,2025-08-02T00:00:00
RET_000970,HyperDrive HYP64007 Gimbal Smartphone 3-Axis,HYP-000970,HyperDrive,2609.63,R-014249,Electronics,166,WH-CENTRAL,2024-10-19T00:00:00
RET_002986,Monoprice MON265607 HDMI Cable 6ft,MON-002986,Monoprice,1194.32,R-065675,Appliances,15,WH-CENTRAL,2025-04-15T00:00:00
RET_001372,PNY PNY104207 SD Card 256GB,PNY-001372,PNY,534.48,R-045100,Photography,10,WH-NORTH,2025-01-21T00:00:00
RET_003547,OtterBox OTT321707 FM Transmitter Car,OTT-003547,OtterBox,2102.16,R-041028,Networking,4,WH-EAST,2024-08-15T00:00:00
RET_000378,SPIGEN SPI4807 XLR Cable 10ft,SPI-000378,Spigen,1468.43,R-059554,Networking,166,WH-SOUTH,2024-07-03T00:00:00
RET_003650,Mophie MOP332007 Battery Pack AAA 12-Pack,MOP-003650,Mophie,177.66,R-041464,Storage,26,WH-NORTH,2024-09-23T00:00:00
RET_002438,Spigen SPI210807 Laptop Cooling Pad 15-inch,SPI-002438,Spigen,1839.18,R-013013,Electronics,39,WH-SOUTH,2025-05-19T00:00:00
RET_002223,DYNEX DYN189307 Battery Pack AAA 12-Pack,DYN-002223,Dynex,818.52,R-058485,Networking,179,WH-WEST,2024-12-01T00:00:00
RET_000330,ESR ESR0007 Extension Cord 10ft,ESR-000330,ESR,2641.85,R-099038,Appliances,15,WH-CENTRAL,2025-03-14T00:00:00
RET_000631,Tripp Lite TRI30107 Wireless Charger Stand 20W,TRI-000631,Tripp Lite,3400.86,R-055384,Computing,145,WH-WEST,2024-09-17T00:00:00
RET_003532,Tripp Lite TRI320207 Laptop Sleeve 15-inch,TRI-003532,Tripp Lite,1310.61,R-038021,Computing,63,WH-NORTH,2025-03-03T00:00:00
RET_003204,UGREEN UGR287407 Laptop Stand Adjustable,UGR-003204,UGREEN,3173.61,R-049023,Appliances,17,WH-EAST,2024-10-24T00:00:00
RET_000078,HP M24f FHD Monitor,HP-000078,HP,1172.18,R-036500,Gaming,138,WH-CENTRAL,2024-08-06T00:00:00
RET_001204,OtterBox OTT87407 Laptop Stand Adjustable,OTT-001204,OtterBox,2867.96,R-045917,Office,125,WH-NORTH,2025-03-23T00:00:00
RET_000225,Corsair RM1000x 1000W 80+ Gold PSU,COR-000225,Corsair,1766.11,R-061807,Audio,42,WH-CENTRAL,2025-02-04T00:00:00
RET_001796,StarTech STA146607 Hard Drive Case Shockproof,STA-001796,StarTech,2030.34,R-053896,Storage,37,WH-SOUTH,2024-04-19T00:00:00
RET_002708,HyperDrive HYP237807 Stylus Pen iPad,HYP-002708,HyperDrive,2255.32,R-038973,Storage,5,WH-EAST,2024-10-14T00:00:00
RET_002928,Dynex DYN259807 Gimbal Smartphone 3-Axis,DYN-002928,Dynex,1513.20,R-098248,Networking,18,WH-NORTH,2025-04-17T00:00:00
RET_003338,INSIGNIA INS300807 Microphone Pop Filter,INS-003338,Insignia,2200.91,R-085430,Computing,26,WH-WEST,2025-06-29T00:00:00
RET_000668,SPIGEN SPI33807 Laptop Backpack,SPI-000668,Spigen,3554.57,R-034596,Photography,118,WH-NORTH,2024-08-23T00:00:00
RET_003301,StarTech STA297107 Ethernet Cat6 Cable 50ft,STA-003301,StarTech,2713.41,R-085075,Electronics,20,WH-NORTH,2024-03-14T00:00:00
RET_002356,Spigen SPI202607 Desk Lamp LED USB,SPI-002356,Spigen,2513.33,R-024034,Audio,57,WH-CENTRAL,2024-11-29T00:00:00
RET_002893,Baseus BAS256307 Rechargeable Battery Kit,BAS-002893,Baseus,2665.04,R-072012,Audio,137,WH-CENTRAL,2025-05-28T00:00:00
RET_001989,Targus TAR165907 Privacy Screen 13-inch,TAR-001989,Targus,3006.73,R-038816,Gaming,76,WH-EAST,2024-11-24T00:00:00
RET_003304,CalDigit CAL297407 VGA to HDMI Adapter,CAL-003304,CalDigit,3429.06,R-045930,Computing,190,WH-NORTH,2024-09-28T00:00:00
RET_001320,PNY PNY99007 HDMI Cable 6ft,PNY-001320,PNY,1511.78,R-062746,Photography,122,WH-CENTRAL,2024-01-15T00:00:00
RET_000319,Crucial DDR4 32GB 3200MHz Kit,CRU-000319,Crucial,3877.36,R-035270,Networking,62,WH-CENTRAL,2025-03-31T00:00:00
RET_001108,Kensington KEN77807 Battery Pack AA 8-Pack,KEN-001108,Kensington,138.94,R-097889,Networking,6,WH-NORTH,2025-02-09T00:00:00
RET_002497,INIU INI216707 Ethernet Cat6 Cable 25ft,INI-002497,INIU,937.32,R-046701,Appliances,150,WH-EAST,2024-07-06T00:00:00
RET_000127,LG InstaView French Door Refrigerator,LG-000127,LG,3351.34,R-033494,Smart Home,90,WH-CENTRAL,2024-06-14T00:00:00
RET_001577,JETech JET124707 Power Strip 6-Outlet,JET-001577,JETech,2889.37,R-071773,Computing,81,WH-CENTRAL,2024-05-14T00:00:00
RET_000328,WD Red Plus 8TB NAS HDD,WD-000328,WD,3567.45,R-072988,Gaming,133,WH-WEST,2024-04-11T00:00:00
RET_001429,Plugable PLU109907 Wall Mount 55-inch,PLU-001429,Plugable,709.97,R-015209,Appliances,14,WH-SOUTH,2024-09-08T00:00:00
RET_003389,Twelve South TWE305907 Monitor Stand Riser,TWE-003389,Twelve South,961.88,R-098142,Audio,150,WH-NORTH,2024-01-26T00:00:00
RET_000654,Syncwire SYN32407 RCA Cable 6ft,SYN-000654,Syncwire,309.99,R-055177,Office,11,WH-WEST,2024-02-07T00:00:00
RET_000590,Tripp Lite TRI26007 Camera Bag Sling,TRI-000590,Tripp Lite,2777.85,R-046394,Storage,63,WH-CENTRAL,2025-03-16T00:00:00
RET_003470,CalDigit CAL314007 Extension Cord 10ft,CAL-003470,CalDigit,1676.50,R-068422,Storage,42,WH-NORTH,2024-01-19T00:00:00
RET_001773,Insignia INS144307 Rechargeable Battery Kit,INS-001773,Insignia,2188.76,R-056130,Office,141,WH-SOUTH,2024-02-08T00:00:00
RET_000283,JBL Xtreme 4 Bluetooth Speaker,JBL-000283,JBL,2146.04,R-094142,Gaming,2,WH-EAST,2024-09-10T00:00:00
RET_001569,SYNCWIRE SYN123907 Laptop Sleeve 15-inch,SYN-001569,Syncwire,943.15,R-073023,Photography,57,WH-WEST,2025-06-16T00:00:00
RET_000767,OtterBox OTT43707 Banana Plug Connector 4-Pack,OTT-000767,OtterBox,3210.24,R-037988,Computing,153,WH-NORTH,2025-05-05T00:00:00
RET_001702,Satechi SAT137207 Trackpad Protector Film,SAT-001702,Satechi,695.99,R-062875,Networking,101,WH-SOUTH,2025-06-28T00:00:00
RET_001705,Cable Matters CAB137507 Cable Ties 100-Pack,CAB-001705,Cable Matters,1384.81,R-051117,Smart Home,61,WH-SOUTH,2024-08-13T00:00:00
RET_001207,Spigen SPI87707 TOSLINK Cable 3ft,SPI-001207,Spigen,632.36,R-021981,Gaming,72,WH-WEST,2024-09-23T00:00:00
RET_001345,OtterBox OTT101507 Power Strip 8-Outlet USB,OTT-001345,OtterBox,1360.50,R-038589,Office,21,WH-NORTH,2025-03-07T00:00:00
RET_002692,HyperDrive HYP236207 Ethernet Cat6 Cable 50ft,HYP-002692,HyperDrive,1911.15,R-041417,Smart Home,55,WH-SOUTH,2024-11-20T00:00:00
RET_002992,KENSINGTON KEN266207 Wireless Charger Pad 15W,KEN-002992,Kensington,3967.51,R-010941,Networking,85,WH-SOUTH,2025-01-24T00:00:00
RET_000460,Plugable PLU13007 Docking Station USB-C Triple Display,PLU-000460,Plugable,3345.30,R-050590,Smart Home,15,WH-WEST,2024-11-19T00:00:00
RET_000512,STARTECH STA18207 Phone Case Rugged,STA-000512,StarTech,1340.00,R-060127,Storage,177,WH-NORTH,2024-04-05T00:00:00
RET_000785,AmazonBasics AMA45507 Hub USB 3.0 4-Port,AMA-000785,AmazonBasics,3571.28,R-041275,Gaming,114,WH-EAST,2024-11-23T00:00:00
RET_000854,Belkin BEL52407 Wall Mount 55-inch,BEL-000854,Belkin,1658.11,R-024202,Storage,49,WH-EAST,2024-05-16T00:00:00
RET_000169,Anker Soundcore Motion 300,ANK-000169,Anker,3844.70,R-026368,Appliances,3,WH-EAST,2024-08-29T00:00:00
RET_002171,PNY PNY184107 VGA to HDMI Adapter,PNY-002171,PNY,3186.95,R-081673,Networking,85,WH-CENTRAL,2025-03-11T00:00:00
RET_002495,Nillkin NIL216507 Camera Bag Backpack,NIL-002495,Nillkin,615.57,R-068859,Electronics,17,WH-SOUTH,2024-05-28T00:00:00
RET_001526,AmazonBasics AMA119607 USB-C Cable 10ft,AMA-001526,AmazonBasics,2194.97,R-026670,Electronics,71,WH-CENTRAL,2024-01-04T00:00:00
RET_003713,Sabrent SAB338307 Bluetooth Receiver,SAB-003713,Sabrent,3022.03,R-072962,Electronics,69,WH-EAST,2025-03-21T00:00:00
RET_000538,Targus TAR20807 USB Flash Drive 128GB,TAR-000538,Targus,1521.57,R-038410,Office,73,WH-EAST,2025-02-16T00:00:00
RET_003198,Insignia INS286807 Phone Mount Car Vent,INS-003198,Insignia,2601.41,R-020088,Photography,47,WH-SOUTH,2024-04-25T00:00:00
RET_000790,CalDigit CAL46007 Laptop Sleeve 15-inch,CAL-000790,CalDigit,771.23,R-029219,Electronics,182,WH-NORTH,2024-10-17T00:00:00
RET_002782,UGREEN UGR245207 Webcam Ring Light 10-inch,UGR-002782,UGREEN,677.93,R-040633,Photography,166,WH-NORTH,2024-02-19T00:00:00
RET_002739,Monoprice MON240907 Lightning Cable 3ft,MON-002739,Monoprice,3158.45,R-014336,Electronics,108,WH-CENTRAL,2024-04-25T00:00:00
RET_001484,Targus TAR115407 Wrist Rest Mouse,TAR-001484,Targus,2747.61,R-037738,Storage,122,WH-CENTRAL,2024-08-28T00:00:00
RET_003431,PLUGABLE PLU310107 Lightning Cable 3ft,PLU-003431,Plugable,830.17,R-035256,Gaming,90,WH-NORTH,2025-08-05T00:00:00
RET_001130,PNY PNY80007 MicroSD Card 256GB,PNY-001130,PNY,1564.12,R-026203,Appliances,163,WH-EAST,2025-01-29T00:00:00
RET_002382,Dynex DYN205207 USB-C Cable 10ft,DYN-002382,Dynex,2077.54,R-078874,Photography,152,WH-CENTRAL,2024-06-21T00:00:00
RET_003804,Belkin BEL347407 RCA Cable 6ft,BEL-003804,Belkin,2066.80,R-062968,Computing,100,WH-EAST,2025-07-20T00:00:00
RET_001754,PNY PNY142407 Headphone Stand Wood,PNY-001754,PNY,2378.57,R-028623,Networking,72,WH-EAST,2024-04-24T00:00:00
RET_002974,Mophie MOP264407 Phone Mount Desk,MOP-002974,Mophie,2620.93,R-084914,Appliances,72,WH-CENTRAL,2024-05-03T00:00:00
RET_002056,Syncwire SYN172607 Microphone Pop Filter,SYN-002056,Syncwire,2987.83,R-071214,Networking,81,WH-NORTH,2024-01-27T00:00:00
RET_000388,Belkin BEL5807 Headphone Stand Wood,BEL-000388,Belkin,944.03,R-054294,Appliances,75,WH-EAST,2024-07-04T00:00:00
RET_001112,Nillkin NIL78207 Anti-Glare Screen Film 27-inch,NIL-001112,Nillkin,1652.10,R-064448,Office,47,WH-CENTRAL,2024-05-11T00:00:00
RET_001168,PNY PNY83807 USB Fan Mini Portable,PNY-001168,PNY,3285.25,R-077998,Audio,53,WH-EAST,2025-07-19T00:00:00
RET_003495,Kensington KEN316507 Wall Mount 65-inch,KEN-003495,Kensington,1060.28,R-035407,Gaming,141,WH-EAST,2024-01-03T00:00:00
RET_003798,PLUGABLE PLU346807 Trackpad Protector Film,PLU-003798,Plugable,2238.83,R-011770,Storage,68,WH-SOUTH,2024-05-16T00:00:00
RET_002734,Nillkin NIL240407 Adapter Lightning to USB-C,NIL-002734,Nillkin,3416.86,R-082014,Networking,139,WH-EAST,2024-11-15T00:00:00
RET_003401,Belkin BEL307107 Speaker Wire 50ft 14AWG,BEL-003401,Belkin,2095.60,R-018171,Storage,30,WH-NORTH,2025-01-18T00:00:00
RET_001201,Tripp Lite TRI87107 Laptop Stand Adjustable,TRI-001201,Tripp Lite,1713.15,R-097042,Office,71,WH-NORTH,2024-07-14T00:00:00
RET_000073,HP EliteBook 840 G10 i7 vPro,HP-000073,HP,993.77,R-061050,Networking,198,WH-EAST,2024-01-07T00:00:00
RET_000547,StarTech STA21707 SD Card 256GB,STA-000547,StarTech,1143.33,R-080393,Gaming,128,WH-CENTRAL,2024-09-23T00:00:00
RET_002183,Monoprice MON185307 Anti-Glare Screen Film 27-inch,MON-002183,Monoprice,436.47,R-094172,Photography,11,WH-EAST,2024-11-10T00:00:00
RET_000822,OtterBox OTT49207 Portable SSD Case,OTT-000822,OtterBox,494.82,R-085292,Computing,147,WH-NORTH,2024-12-21T00:00:00
RET_002352,Insignia INS202207 Speaker Wire 50ft 14AWG,INS-002352,Insignia,244.50,R-052253,Computing,108,WH-EAST,2024-08-07T00:00:00
RET_002905,Belkin BEL257507 Ethernet Cat6 Cable 50ft,BEL-002905,Belkin,2213.21,R-055659,Audio,165,WH-SOUTH,2024-09-02T00:00:00
RET_000318,Crucial DDR5 16GB 4800MHz,CRU-000318,Crucial,705.05,R-095056,Office,15,WH-EAST,2025-07-13T00:00:00
RET_003322,Spigen SPI299207 Bluetooth Audio Transmitter,SPI-003322,Spigen,386.94,R-084674,Electronics,75,WH-NORTH,2024-01-14T00:00:00
RET_000160,Anker PowerConf S500 Speakerphone,ANK-000160,Anker,2572.41,R-015694,Storage,194,WH-EAST,2025-08-18T00:00:00
RET_002265,JETech JET193507 Cable Ties 100-Pack,JET-002265,JETech,959.42,R-080846,Networking,106,WH-CENTRAL,2024-08-09T00:00:00
RET_001127,PNY PNY79707 Phone Mount Car Vent,PNY-001127,PNY,1544.76,R-019488,Electronics,148,WH-EAST,2024-10-06T00:00:00
RET_003598,Kensington KEN326807 Phone Mount Car Vent,KEN-003598,Kensington,1059.20,R-026712,Electronics,40,WH-NORTH,2024-07-17T00:00:00
RET_000308,NZXT N7 Z790 Motherboard,NZX-000308,NZXT,1792.18,R-070317,Storage,159,WH-NORTH,2024-07-10T00:00:00
RET_001677,CABLE MATTERS CAB134707 Laptop Cooling Pad 17-inch,CAB-001677,Cable Matters,2373.33,R-028509,Audio,97,WH-NORTH,2025-02-16T00:00:00
RET_001842,Spigen SPI151207 Privacy Screen 15.6-inch,SPI-001842,Spigen,2365.05,R-088780,Gaming,164,WH-SOUTH,2025-01-07T00:00:00
