inventory_id,description,manufacturer_code,brand_name,retail_price,store_sku,department,qty_on_hand,warehouse,last_received
RET_002313,AmazonBasics AMA198307 Microphone Boom Arm,AMA-002313,AmazonBasics,1243.04,R-052905,Photography,31,WH-CENTRAL,2025-04-26T00:00:00
RET_003390,INIU INI306007 USB-C Cable 6ft,INI-003390,INIU,666.59,R-047531,Storage,168,WH-WEST,2025-06-10T00:00:00
RET_000674,Nillkin NIL34407 Tripod 60-inch Aluminum,NIL-000674,Nillkin,2809.05,R-030079,Gaming,136,WH-EAST,2024-10-28T00:00:00
RET_003582,UGREEN UGR325207 Audio Splitter 3.5mm,UGR-003582,UGREEN,1197.42,R-033958,Networking,135,WH-CENTRAL,2025-05-19T00:00:00
RET_002798,PNY PNY246807 Privacy Screen 15.6-inch,PNY-002798,PNY,2637.65,R-086266,Networking,109,WH-SOUTH,2024-08-29T00:00:00
RET_003123,AmazonBasics AMA279307 Screen Protector Glass,AMA-003123,AmazonBasics,445.00,R-035313,Appliances,187,WH-NORTH,2025-01-20T00:00:00
RET_001889,JETech JET155907 USB Flash Drive 64GB,JET-001889,JETech,1471.75,R-048804,Gaming,99,WH-WEST,2024-09-06T00:00:00
RET_003554,Twelve South TWE322407 Privacy Screen 15.6-inch,TWE-003554,Twelve South,1330.44,R-025578,Computing,108,WH-SOUTH,2024-04-17T00:00:00
RET_001084,HyperDrive HYP75407 USB-C Cable 10ft,HYP-001084,HyperDrive,2855.73,R-027713,Electronics,12,WH-NORTH,2024-05-06T00:00:00
RET_000665,JETECH JET33507 VGA to HDMI Adapter,JET-000665,JETech,1561.75,R-018830,Computing,9,WH-NORTH,2024-01-01T00:00:00
RET_000258,Canon EOS R8 Body,CAN-000258,Canon,1125.19,R-047710,Computing,192,WH-WEST,2025-04-15T00:00:00
RET_002555,Twelve South TWE222507 Gimbal Smartphone 3-Axis,TWE-002555,Twelve South,3145.46,R-032412,Appliances,154,WH-EAST,2024-11-29T00:00:00
RET_003096,Tripp Lite TRI276607 Headphone Stand Aluminum,TRI-003096,Tripp Lite,1646.56,R-043454,Computing,3,WH-CENTRAL,2024-01-07T00:00:00
RET_002232,Twelve South TWE190207 Speaker Wire 50ft 14AWG,TWE-002232,Twelve South,1718.86,R-063277,Office,184,WH-WEST,2024-05-14T00:00:00
RET_000741,Belkin BEL41107 SD Card 128GB,BEL-000741,Belkin,1865.58,R-067841,Gaming,118,WH-SOUTH,2025-08-19T00:00:00
RET_002737,CalDigit CAL240707 Power Strip 8-Outlet USB,CAL-002737,CalDigit,1164.46,R-033957,Photography,93,WH-NORTH,2024-07-08T00:00:00
RET_003300,AmazonBasics AMA297007 USB Flash Drive 128GB,AMA-003300,AmazonBasics,2491.70,R-062957,Office,63,WH-NORTH,2025-03-10T00:00:00
RET_003271,Twelve South TWE294107 Hub USB-C 7-in-1,TWE-003271,Twelve South,433.53,R-059638,Appliances,54,WH-NORTH,2024-03-23T00:00:00
RET_002072,Belkin BEL174207 Cable Management Box Large,BEL-002072,Belkin,3444.13,R-049106,Electronics,73,WH-EAST,2024-01-21T00:00:00
RET_000179,Microsoft Surface Laptop Studio 2 i7,MIC-000179,Microsoft,1992.51,R-099621,Smart Home,42,WH-CENTRAL,2024-03-28T00:00:00
RET_000137,Logitech G Pro X Superlight 2 Mouse,LOG-000137,Logitech,3116.99,R-030095,Appliances,60,WH-CENTRAL,2024-05-19T00:00:00
RET_000151,BOSE SoundLink Micro Bluetooth Speaker,BOS-000151,Bose,1469.60,R-030665,Audio,152,WH-EAST,2024-04-29T00:00:00
RET_003546,Belkin BEL321607 DisplayPort Cable 6ft,BEL-003546,Belkin,2365.04,R-065784,Electronics,43,WH-CENTRAL,2024-03-05T00:00:00
RET_000880,Kensington KEN55007 Screen Protector Film,KEN-000880,Kensington,3275.85,R-082345,Storage,105,WH-SOUTH,2024-03-24T00:00:00
RET_000484,JSAUX JSA15407 Laptop Cooling Pad 17-inch,JSA-000484,JSAUX,2953.59,R-052570,Computing,176,WH-NORTH,2024-02-27T00:00:00
RET_002114,CalDigit CAL178407 Phone Case Clear,CAL-002114,CalDigit,1286.80,R-055298,Appliances,162,WH-WEST,2024-05-11T00:00:00
RET_003261,Belkin BEL293107 Camera Bag Sling,BEL-003261,Belkin,1395.15,R-098565,Electronics,27,WH-NORTH,2025-01-29T00:00:00
RET_002570,StarTech STA224007 Portable SSD Case,STA-002570,StarTech,2265.99,R-055751,Networking,21,WH-WEST,2024-11-02T00:00:00
RET_003027,Tripp Lite TRI269707 Tablet Case Folio,TRI-003027,Tripp Lite,1179.88,R-021262,Appliances,139,WH-SOUTH,2025-07-05T00:00:00
RET_002218,Baseus BAS188807 HDMI Splitter 1x4,BAS-002218,Baseus,1840.62,R-040881,Smart Home,23,WH-SOUTH,2024-03-29T00:00:00
RET_002686,Targus TAR235607 TOSLINK Cable 3ft,TAR-002686,Targus,3569.14,R-012372,Photography,11,WH-WEST,2024-08-19T00:00:00
RET_003010,CABLE MATTERS CAB268007 USB Flash Drive 128GB,CAB-003010,Cable Matters,645.72,R-086759,Gaming,73,WH-NORTH,2024-11-26T00:00:00
RET_002020,AmazonBasics AMA169007 Phone Mount Car Vent,AMA-002020,AmazonBasics,676.44,R-069324,Gaming,167,WH-SOUTH,2024-10-29T00:00:00
RET_000775,INIU INI44507 Privacy Screen 15.6-inch,INI-000775,INIU,607.57,R-039559,Storage,65,WH-NORTH,2024-04-07T00:00:00
RET_000455,Plugable PLU12507 XLR Cable 10ft,PLU-000455,Plugable,2534.30,R-021855,Gaming,167,WH-WEST,2024-02-28T00:00:00
RET_003448,Mophie MOP311807 HDMI Splitter 1x4,MOP-003448,Mophie,3613.91,R-082996,Electronics,23,WH-EAST,2025-08-11T00:00:00
RET_002891,TWELVE SOUTH TWE256107 Keyboard Cover Silicone,TWE-002891,Twelve South,99.01,R-032077,Appliances,114,WH-CENTRAL,2025-04-11T00:00:00
RET_002025,Baseus BAS169507 Gimbal Smartphone 3-Axis,BAS-002025,Baseus,3197.57,R-099557,Smart Home,153,WH-CENTRAL,2024-09-18T00:00:00
RET_002278,Sabrent SAB194807 Wrist Rest Keyboard,SAB-002278,Sabrent,2106.03,R-022036,Electronics,85,WH-NORTH,2025-05-05T00:00:00
RET_002034,Kensington KEN170407 Ethernet Cat6 Cable 50ft,KEN-002034,Kensington,508.52,R-082042,Smart Home,158,WH-WEST,2024-09-25T00:00:00
RET_000132,LOGITECH MX Keys S Wireless Keyboard,LOG-000132,Logitech,2623.62,R-084261,Electronics,8,WH-WEST,2024-12-30T00:00:00
RET_000759,BELKIN BEL42907 Laptop Stand Adjustable,BEL-000759,Belkin,3086.94,R-052243,Audio,71,WH-WEST,2024-07-26T00:00:00
RET_002574,Sabrent SAB224407 Keyboard Cover Silicone,SAB-002574,Sabrent,417.42,R-099289,Networking,3,WH-EAST,2025-03-19T00:00:00
RET_003826,HYPERDRIVE HYP349607 Gimbal Smartphone 3-Axis,HYP-003826,HyperDrive,2672.58,R-020852,Computing,30,WH-SOUTH,2024-01-07T00:00:00
RET_003597,Belkin BEL326707 SD Card 128GB,BEL-003597,Belkin,2226.07,R-051188,Office,44,WH-WEST,2024-04-11T00:00:00
RET_000963,AMAZONBASICS AMA63307 Battery Pack AA 8-Pack,AMA-000963,AmazonBasics,838.37,R-054503,Gaming,148,WH-EAST,2024-10-27T00:00:00
RET_003265,Insignia INS293507 VGA to HDMI Adapter,INS-003265,Insignia,2403.91,R-033791,Computing,105,WH-NORTH,2024-08-20T00:00:00
RET_002032,HyperDrive HYP170207 Phone Mount Desk,HYP-002032,HyperDrive,2156.59,R-050063,Gaming,60,WH-CENTRAL,2024-12-07T00:00:00
RET_000693,Tripp Lite TRI36307 Tripod Mini Tabletop,TRI-000693,Tripp Lite,592.17,R-047291,Gaming,3,WH-WEST,2025-08-19T00:00:00
RET_003348,StarTech STA301807 Laptop Sleeve 13-inch,STA-003348,StarTech,241.03,R-090434,Appliances,84,WH-WEST,2024-11-27T00:00:00
RET_001646,CalDigit CAL131607 Cable Management Box Small,CAL-001646,CalDigit,1122.53,R-073426,Photography,157,WH-SOUTH,2024-10-14T00:00:00
RET_001556,Nillkin NIL122607 Docking Station USB-C Triple Display,NIL-001556,Nillkin,741.29,R-057810,Appliances,149,WH-CENTRAL,2025-04-19T00:00:00
RET_003730,UGREEN UGR340007 Hub USB-C 7-in-1,UGR-003730,UGREEN,3758.15,R-045037,Photography,78,WH-NORTH,2024-11-26T00:00:00
RET_000690,Belkin BEL36007 DisplayPort Cable 6ft,BEL-000690,Belkin,1255.09,R-092469,Storage,35,WH-NORTH,2024-03-25T00:00:00
RET_003484,Cable Matters CAB315407 Audio Splitter 3.5mm,CAB-003484,Cable Matters,202.73,R-041402,Office,9,WH-SOUTH,2024-08-03T00:00:00
RET_003311,Plugable PLU298107 XLR Cable 10ft,PLU-003311,Plugable,233.61,R-089597,Photography,135,WH-NORTH,2025-05-24T00:00:00
RET_001798,INSIGNIA INS146807 Guitar Cable 20ft,INS-001798,Insignia,1969.56,R-099695,Gaming,36,WH-CENTRAL,2025-08-16T00:00:00
RET_002793,Insignia INS246307 Power Strip 6-Outlet,INS-002793,Insignia,2542.58,R-097122,Electronics,192,WH-WEST,2024-11-15T00:00:00
RET_002292,Belkin BEL196207 Microfiber Cloth 6-Pack,BEL-002292,Belkin,1203.37,R-022027,Gaming,100,WH-SOUTH,2024-08-03T00:00:00
RET_003473,INIU INI314307 Tripod 60-inch Aluminum,INI-003473,INIU,492.00,R-091045,Computing,196,WH-WEST,2024-03-17T00:00:00
RET_000267,Sonos Era 100 Speaker,SON-000267,Sonos,3278.08,R-076711,Appliances,21,WH-NORTH,2025-07-03T00:00:00
RET_002070,UGREEN UGR174007 Car Charger Dual USB-C,UGR-002070,UGREEN,1079.60,R-039406,Audio,96,WH-WEST,2024-09-11T00:00:00
RET_002573,Insignia INS224307 Battery Pack AA 8-Pack,INS-002573,Insignia,4021.59,R-033262,Appliances,37,WH-SOUTH,2025-07-22T00:00:00
RET_002073,Nillkin NIL174307 Tripod Mini Tabletop,NIL-002073,Nillkin,371.76,R-062347,Appliances,129,WH-WEST,2025-01-26T00:00:00
RET_001186,Satechi SAT85607 Tripod Mini Tabletop,SAT-001186,Satechi,3296.19,R-012394,Computing,93,WH-EAST,2024-10-15T00:00:00
RET_001313,JSAUX JSA98307 Audio Interface USB-C 2-Channel,JSA-001313,JSAUX,3019.96,R-011980,Storage,126,WH-WEST,2024-01-16T00:00:00
RET_001037,Kensington KEN70707 MicroSD Card 512GB,KEN-001037,Kensington,975.26,R-030232,Networking,194,WH-EAST,2025-06-21T00:00:00
RET_000863,Spigen SPI53307 Microphone Boom Arm,SPI-000863,Spigen,3880.33,R-028031,Smart Home,71,WH-WEST,2025-03-18T00:00:00
RET_002545,AmazonBasics AMA221507 USB-C Cable 6ft,AMA-002545,AmazonBasics,2695.71,R-090589,Storage,34,WH-EAST,2025-08-10T00:00:00
RET_003188,Twelve South TWE285807 Anti-Glare Screen Film 27-inch,TWE-003188,Twelve South,1571.56,R-035446,Audio,59,WH-NORTH,2025-04-13T00:00:00
RET_001489,Baseus BAS115907 Ethernet Cat6 Cable 25ft,BAS-001489,Baseus,1776.30,R-069133,Smart Home,197,WH-NORTH,2024-03-11T00:00:00
RET_001530,JSAUX JSA120007 HDMI Splitter 1x4,JSA-001530,JSAUX,2544.47,R-062456,Office,76,WH-WEST,2025-07-07T00:00:00
RET_002983,JSAUX JSA265307 Trackpad Protector Film,JSA-002983,JSAUX,1196.61,R-088121,Appliances,44,WH-NORTH,2025-05-25T00:00:00
RET_003789,JETech JET345907 HDMI Switch 3x1,JET-003789,JETech,751.80,R-016756,Smart Home,2,WH-EAST,2024-11-10T00:00:00
RET_000410,AmazonBasics AMA8007 Monitor Arm Single,AMA-000410,AmazonBasics,392.86,R-072284,Smart Home,136,WH-CENTRAL,2025-07-07T00:00:00
RET_003823,Dynex DYN349307 Portable SSD Case,DYN-003823,Dynex,3670.76,R-016526,Photography,194,WH-EAST,2024-06-12T00:00:00
RET_000670,Cable Matters CAB34007 Laptop Cooling Pad 15-inch,CAB-000670,Cable Matters,684.42,R-077905,Smart Home,178,WH-CENTRAL,2025-07-01T00:00:00
RET_002984,PNY PNY265407 Stylus Pen Universal,PNY-002984,PNY,391.32,R-015313,Smart Home,119,WH-EAST,2024-09-28T00:00:00
RET_002985,CABLE MATTERS CAB265507 TOSLINK Cable 3ft,CAB-002985,Cable Matters,2349.79,R-098755,Gaming,9,WH-CENTRAL,2024-04-02T00:00:00
RET_003037,Satechi SAT270707 Laptop Cooling Pad 17-inch,SAT-003037,Satechi,352.42,R-043511,Storage,146,WH-WEST,2024-10-19T00:00:00
RET_003174,Targus TAR284407 Headphone Stand Wood,TAR-003174,Targus,3581.28,R-086371,Gaming,126,WH-WEST,2024-02-25T00:00:00
RET_002583,Insignia INS225307 USB Fan Mini Portable,INS-002583,Insignia,2752.05,R-057147,Office,149,WH-WEST,2024-09-11T00:00:00
RET_002425,HyperDrive HYP209507 Laptop Backpack,HYP-002425,HyperDrive,1426.59,R-059897,Computing,107,WH-NORTH,2024-08-11T00:00:00
RET_001081,Dynex DYN75107 Adapter Lightning to USB-C,DYN-001081,Dynex,366.60,R-087864,Gaming,115,WH-SOUTH,2024-02-27T00:00:00
RET_002370,CalDigit CAL204007 Camera Bag Sling,CAL-002370,CalDigit,2961.14,R-075324,Appliances,163,WH-SOUTH,2024-08-22T00:00:00
RET_002550,Sabrent SAB222007 Ring Light 12-inch Kit,SAB-002550,Sabrent,215.20,R-082103,Office,83,WH-WEST,2024-03-07T00:00:00
RET_000347,Tripp Lite TRI1707 HDMI Splitter 1x4,TRI-000347,Tripp Lite,268.64,R-037300,Gaming,200,WH-EAST,2024-09-18T00:00:00
RET_002119,INIU INI178907 VGA to HDMI Adapter,INI-002119,INIU,3619.49,R-042494,Computing,174,WH-CENTRAL,2025-06-12T00:00:00
RET_001486,MOPHIE MOP115607 Wall Mount 65-inch,MOP-001486,Mophie,2091.73,R-095492,Networking,109,WH-SOUTH,2024-02-13T00:00:00
RET_001439,Dynex DYN110907 Laptop Sleeve 13-inch,DYN-001439,Dynex,123.19,R-089783,Computing,86,WH-SOUTH,2025-06-30T00:00:00
RET_001082,Dynex DYN75207 Anti-Glare Screen Film 27-inch,DYN-001082,Dynex,3260.13,R-018945,Networking,195,WH-NORTH,2025-06-13T00:00:00
RET_003445,StarTech STA311507 Hub USB-C 7-in-1,STA-003445,StarTech,3064.29,R-075993,Photography,23,WH-SOUTH,2024-02-08T00:00:00
RET_001440,JETech JET111007 Tripod 60-inch Aluminum,JET-001440,JETech,946.89,R-057861,Photography,187,WH-CENTRAL,2024-07-09T00:00:00
RET_000351,Syncwire SYN2107 Ring Light 12-inch Kit,SYN-000351,Syncwire,1362.95,R-098000,Storage,162,WH-NORTH,2024-11-23T00:00:00
RET_001404,JSAUX JSA107407 Banana Plug Connector 4-Pack,JSA-001404,JSAUX,344.36,R-025858,Office,161,WH-WEST,2025-06-09T00:00:00
RET_001854,CalDigit CAL152407 Screen Protector Glass,CAL-001854,CalDigit,1146.72,R-087852,Networking,132,WH-WEST,2024-06-24T00:00:00
RET_003172,UGREEN UGR284207 Wall Mount 65-inch,UGR-003172,UGREEN,2788.23,R-076455,Computing,165,WH-CENTRAL,2024-10-10T00:00:00
RET_001281,Satechi SAT95107 Battery Pack AA 8-Pack,SAT-001281,Satechi,334.05,R-017696,Photography,22,WH-EAST,2024-03-07T00:00:00
RET_001356,Belkin BEL102607 Phone Case Rugged,BEL-001356,Belkin,2942.67,R-082274,Gaming,66,WH-EAST,2025-04-03T00:00:00
RET_002190,Sabrent SAB186007 Stylus Pen Universal,SAB-002190,Sabrent,2334.73,R-048270,Audio,119,WH-CENTRAL,2024-08-13T00:00:00
RET_000398,Plugable PLU6807 Wireless Charger Pad 15W,PLU-000398,Plugable,423.08,R-075271,Computing,22,WH-EAST,2024-06-04T00:00:00
RET_002547,BASEUS BAS221707 Phone Case Clear,BAS-002547,Baseus,3273.70,R-048896,Electronics,16,WH-EAST,2025-04-13T00:00:00
RET_002698,OtterBox OTT236807 Tablet Case Folio,OTT-002698,OtterBox,1775.50,R-040687,Gaming,167,WH-WEST,2024-11-18T00:00:00
RET_000070,HP Envy 16 i7 RTX 4060,HP-000070,HP,2303.30,R-070367,Office,117,WH-EAST,2024-04-02T00:00:00
RET_003493,AmazonBasics AMA316307 Screen Protector Film,AMA-003493,AmazonBasics,2712.22,R-097057,Storage,144,WH-NORTH,2025-03-10T00:00:00
RET_003053,TARGUS TAR272307 Guitar Cable 20ft,TAR-003053,Targus,559.64,R-075951,Gaming,158,WH-SOUTH,2024-06-06T00:00:00
RET_003824,Monoprice MON349407 Cable Management Box Large,MON-003824,Monoprice,1427.82,R-058766,Audio,106,WH-WEST,2024-06-14T00:00:00
RET_002615,HyperDrive HYP228507 Camera Bag Sling,HYP-002615,HyperDrive,3118.73,R-023622,Photography,176,WH-SOUTH,2024-01-13T00:00:00
RET_003080,JSAUX JSA275007 DisplayPort Cable 6ft,JSA-003080,JSAUX,399.68,R-046578,Storage,119,WH-EAST,2024-08-02T00:00:00
RET_001537,Baseus BAS120707 XLR Cable 10ft,BAS-001537,Baseus,1741.75,R-035494,Office,131,WH-WEST,2025-02-05T00:00:00
RET_002219,Mophie MOP188907 Adapter USB-C to USB-A,MOP-002219,Mophie,2382.08,R-092044,Smart Home,47,WH-EAST,2024-01-31T00:00:00
RET_003752,DYNEX DYN342207 Wall Mount 65-inch,DYN-003752,Dynex,1936.14,R-041941,Audio,133,WH-WEST,2024-04-11T00:00:00
RET_003695,UGREEN UGR336507 USB Flash Drive 128GB,UGR-003695,UGREEN,2814.76,R-065756,Smart Home,35,WH-SOUTH,2025-05-30T00:00:00
RET_003653,Dynex DYN332307 Wireless Charger Pad 15W,DYN-003653,Dynex,1154.06,R-099239,Electronics,178,WH-WEST,2025-01-09T00:00:00
RET_003388,OtterBox OTT305807 Headphone Stand Wood,OTT-003388,OtterBox,403.32,R-027222,Audio,172,WH-CENTRAL,2024-06-21T00:00:00
RET_002651,PNY PNY232107 Ethernet Cat6 Cable 25ft,PNY-002651,PNY,2158.62,R-041957,Storage,150,WH-CENTRAL,2024-01-14T00:00:00
RET_002376,SATECHI SAT204607 Ethernet Cat6 Cable 50ft,SAT-002376,Satechi,3238.65,R-024189,Office,81,WH-SOUTH,2025-01-21T00:00:00
RET_003671,AmazonBasics AMA334107 Tripod Mini Tabletop,AMA-003671,AmazonBasics,490.07,R-038435,Smart Home,53,WH-SOUTH,2025-06-11T00:00:00
RET_002493,KENSINGTON KEN216307 HDMI Switch 3x1,KEN-002493,Kensington,1075.82,R-091151,Computing,77,WH-EAST,2024-05-15T00:00:00
RET_002724,JSAUX JSA239407 SD Card 256GB,JSA-002724,JSAUX,3468.76,R-019788,Photography,38,WH-NORTH,2024-04-29T00:00:00
RET_002483,Kensington KEN215307 Docking Station USB-C Triple Display,KEN-002483,Kensington,332.69,R-028121,Photography,148,WH-EAST,2025-05-23T00:00:00
RET_001086,Kensington KEN75607 Headphone Stand Aluminum,KEN-001086,Kensington,901.91,R-048982,Networking,51,WH-CENTRAL,2024-12-19T00:00:00
RET_001273,CalDigit CAL94307 Laptop Stand Adjustable,CAL-001273,CalDigit,1958.24,R-052526,Gaming,125,WH-EAST,2024-12-29T00:00:00
RET_003765,Spigen SPI343507 DisplayPort Cable 6ft,SPI-003765,Spigen,2855.33,R-025578,Gaming,8,WH-SOUTH,2024-09-20T00:00:00
RET_000147,Bose QuietComfort Ultra Earbuds,BOS-000147,Bose,2896.10,R-042738,Photography,143,WH-SOUTH,2024-07-05T00:00:00
RET_001933,Monoprice MON160307 Trackpad Protector Film,MON-001933,Monoprice,1668.81,R-030747,Appliances,33,WH-NORTH,2024-04-05T00:00:00
RET_002480,MOPHIE MOP215007 Portable SSD Case,MOP-002480,Mophie,3091.48,R-037379,Computing,78,WH-EAST,2025-07-25T00:00:00
RET_001749,OtterBox OTT141907 Docking Station USB-C Triple Display,OTT-001749,OtterBox,980.12,R-042225,Storage,2,WH-NORTH,2024-10-27T00:00:00
RET_002051,Belkin BEL172107 Audio Interface USB-C 2-Channel,BEL-002051,Belkin,1571.60,R-066372,Gaming,198,WH-WEST,2024-08-10T00:00:00
RET_002915,AmazonBasics AMA258507 Hub USB-C 7-in-1,AMA-002915,AmazonBasics,3369.34,R-086245,Office,18,WH-WEST,2024-09-07T00:00:00
RET_002127,StarTech STA179707 USB Flash Drive 128GB,STA-002127,StarTech,3179.40,R-057358,Computing,61,WH-WEST,2024-08-19T00:00:00
RET_003279,Targus TAR294907 Wrist Rest Keyboard,TAR-003279,Targus,350.98,R-043933,Audio,52,WH-NORTH,2024-03-28T00:00:00
RET_001887,Spigen SPI155707 Cable Ties 100-Pack,SPI-001887,Spigen,2995.71,R-037800,Appliances,30,WH-NORTH,2024-03-30T00:00:00
RET_003219,Twelve South TWE288907 Camera Lens Protector,TWE-003219,Twelve South,1970.40,R-025941,Computing,6,WH-SOUTH,2024-07-25T00:00:00
RET_003689,Nillkin NIL335907 Thermal Paste 4g,NIL-003689,Nillkin,131.24,R-062198,Audio,105,WH-NORTH,2024-12-01T00:00:00
RET_001603,Dynex DYN127307 FM Transmitter Car,DYN-001603,Dynex,492.55,R-068302,Audio,161,WH-CENTRAL,2024-10-03T00:00:00
RET_003413,Monoprice MON308307 HDMI Splitter 1x4,MON-003413,Monoprice,2185.81,R-022901,Audio,67,WH-EAST,2025-08-18T00:00:00
RET_001478,ESR ESR114807 Cable Organizer Clips,ESR-001478,ESR,281.60,R-082988,Office,123,WH-SOUTH,2025-01-26T00:00:00
RET_003740,StarTech STA341007 Anti-Glare Screen Film 27-inch,STA-003740,StarTech,2107.30,R-079991,Photography,17,WH-NORTH,2024-03-07T00:00:00
RET_003773,INIU INI344307 Bluetooth Receiver,INI-003773,INIU,2246.03,R-026470,Storage,70,WH-EAST,2025-05-11T00:00:00
RET_003670,CABLE MATTERS CAB334007 Car Charger Dual USB-C,CAB-003670,Cable Matters,269.89,R-011659,Photography,44,WH-EAST,2025-04-16T00:00:00
RET_003040,Tripp Lite TRI271007 Privacy Screen 15.6-inch,TRI-003040,Tripp Lite,1410.78,R-044590,Gaming,196,WH-SOUTH,2024-10-21T00:00:00
RET_002518,AmazonBasics AMA218807 Privacy Screen 13-inch,AMA-002518,AmazonBasics,1240.66,R-075101,Networking,193,WH-WEST,2025-05-23T00:00:00
RET_000722,Spigen SPI39207 Bluetooth Receiver,SPI-000722,Spigen,2930.33,R-015289,Photography,79,WH-EAST,2024-05-15T00:00:00
RET_001632,HyperDrive HYP130207 Tripod 60-inch Aluminum,HYP-001632,HyperDrive,2464.97,R-054926,Gaming,166,WH-CENTRAL,2024-07-12T00:00:00
RET_001412,PNY PNY108207 Bluetooth Audio Transmitter,PNY-001412,PNY,1326.72,R-017045,Audio,88,WH-EAST,2024-09-24T00:00:00
RET_000090,Lenovo Yoga 9i 14 i7 OLED,LEN-000090,Lenovo,379.60,R-082939,Networking,116,WH-EAST,2025-08-02T00:00:00
RET_002304,HYPERDRIVE HYP197407 Laptop Sleeve 13-inch,HYP-002304,HyperDrive,2136.34,R-042564,Electronics,137,WH-EAST,2024-03-29T00:00:00
RET_002082,PNY PNY175207 Tablet Case Folio,PNY-002082,PNY,1355.42,R-033100,Gaming,44,WH-SOUTH,2025-06-06T00:00:00
RET_000492,StarTech STA16207 Laptop Sleeve 13-inch,STA-000492,StarTech,2264.40,R-076215,Storage,6,WH-CENTRAL,2025-01-28T00:00:00
RET_003079,STARTECH STA274907 Ring Light 12-inch Kit,STA-003079,StarTech,944.98,R-020431,Computing,83,WH-CENTRAL,2025-04-04T00:00:00
RET_002432,Satechi SAT210207 Wireless Charger Stand 20W,SAT-002432,Satechi,3773.85,R-015579,Audio,116,WH-WEST,2024-04-05T00:00:00
RET_000937,Monoprice MON60707 Thermal Paste 4g,MON-000937,Monoprice,2689.98,R-021570,Electronics,145,WH-WEST,2024-07-07T00:00:00
RET_000642,BASEUS BAS31207 Phone Mount Desk,BAS-000642,Baseus,2435.72,R-025179,Smart Home,199,WH-WEST,2024-11-28T00:00:00
RET_001137,HyperDrive HYP80707 Desk Lamp LED USB,HYP-001137,HyperDrive,848.85,R-061269,Audio,102,WH-CENTRAL,2025-05-08T00:00:00
RET_000095,Lenovo ThinkVision P27h-20 27-inch QHD,LEN-000095,Lenovo,2740.90,R-032593,Networking,71,WH-EAST,2024-11-14T00:00:00
RET_000715,Insignia INS38507 Green Screen Backdrop 5x7ft,INS-000715,Insignia,957.87,R-074956,Office,2,WH-CENTRAL,2025-04-25T00:00:00
RET_002269,Plugable PLU193907 Optical Audio Cable 6ft,PLU-002269,Plugable,951.73,R-080449,Photography,100,WH-CENTRAL,2025-05-20T00:00:00
RET_002133,Cable Matters CAB180307 USB-C Cable 6ft,CAB-002133,Cable Matters,1509.77,R-079325,Gaming,151,WH-SOUTH,2024-10-27T00:00:00
RET_003062,JSAUX JSA273207 Adapter USB-C to HDMI,JSA-003062,JSAUX,659.00,R-010780,Smart Home,136,WH-NORTH,2024-06-12T00:00:00
RET_001883,AmazonBasics AMA155307 Extension Cord 10ft,AMA-001883,AmazonBasics,3101.48,R-076752,Gaming,174,WH-SOUTH,2025-07-11T00:00:00
RET_003364,Mophie MOP303407 Tablet Case Folio,MOP-003364,Mophie,1654.80,R-016633,Smart Home,90,WH-CENTRAL,2025-05-18T00:00:00
RET_000595,StarTech STA26507 MicroSD Card 256GB,STA-000595,StarTech,2659.91,R-083963,Electronics,112,WH-SOUTH,2025-06-23T00:00:00
RET_000876,Insignia INS54607 USB-A to USB-C Cable,INS-000876,Insignia,794.69,R-063815,Photography,133,WH-EAST,2025-03-06T00:00:00
RET_003398,Monoprice MON306807 Cable Management Box Small,MON-003398,Monoprice,3783.35,R-023943,Appliances,127,WH-SOUTH,2024-09-26T00:00:00
RET_002373,Belkin BEL204307 Lightning Cable 3ft,BEL-002373,Belkin,2020.50,R-076264,Storage,154,WH-SOUTH,2024-05-24T00:00:00
RET_003025,Tripp Lite TRI269507 Audio Splitter 3.5mm,TRI-003025,Tripp Lite,2634.40,R-044461,Photography,6,WH-NORTH,2024-01-29T00:00:00
RET_003143,Cable Matters CAB281307 Microfiber Cloth 6-Pack,CAB-003143,Cable Matters,3315.85,R-071385,Smart Home,113,WH-SOUTH,2025-04-06T00:00:00
RET_002606,Baseus BAS227607 USB Flash Drive 64GB,BAS-002606,Baseus,2224.50,R-072448,Gaming,194,WH-WEST,2024-06-13T00:00:00
RET_003479,JSAUX JSA314907 Wrist Rest Mouse,JSA-003479,JSAUX,357.17,R-060972,Photography,143,WH-EAST,2025-03-16T00:00:00
RET_000906,Spigen SPI57607 HDMI Cable 6ft,SPI-000906,Spigen,1393.25,R-076710,Office,96,WH-SOUTH,2025-08-16T00:00:00
RET_000961,UGREEN UGR63107 Surge Protector 12-Outlet,UGR-000961,UGREEN,3331.70,R-051824,Storage,174,WH-EAST,2024-05-14T00:00:00
RET_001609,Belkin BEL127907 Microphone Boom Arm,BEL-001609,Belkin,3011.74,R-024838,Computing,36,WH-NORTH,2025-06-17T00:00:00
RET_000110,Sony BRAVIA XR A95L 65-inch QD-OLED TV,SON-000110,Sony,635.19,R-039171,Office,119,WH-SOUTH,2024-05-15T00:00:00
RET_003510,Syncwire SYN318007 RCA Cable 6ft,SYN-003510,Syncwire,3119.69,R-096677,Appliances,142,WH-SOUTH,2025-01-18T00:00:00
RET_003144,ESR ESR281407 Ring Light 12-inch Kit,ESR-003144,ESR,2774.36,R-018391,Smart Home,18,WH-SOUTH,2025-07-08T00:00:00
RET_001055,PNY PNY72507 Green Screen Backdrop 5x7ft,PNY-001055,PNY,1964.31,R-055900,Storage,16,WH-CENTRAL,2024-10-27T00:00:00
RET_001211,Targus TAR88107 USB-C Cable 6ft,TAR-001211,Targus,819.21,R-069920,Smart Home,194,WH-CENTRAL,2025-07-03T00:00:00
RET_000662,JSAUX JSA33207 Thermal Paste 4g,JSA-000662,JSAUX,3325.47,R-030074,Networking,79,WH-WEST,2025-02-12T00:00:00
RET_002831,Twelve South TWE250107 Portable SSD Case,TWE-002831,Twelve South,2839.37,R-081214,Photography,191,WH-EAST,2025-08-07T00:00:00
RET_000934,Sabrent SAB60407 Screen Protector Film,SAB-000934,Sabrent,1323.27,R-031718,Networking,169,WH-EAST,2025-04-18T00:00:00
RET_001878,Baseus BAS154807 Battery Pack AAA 12-Pack,BAS-001878,Baseus,404.10,R-059390,Audio,89,WH-WEST,2025-02-24T00:00:00
RET_003059,UGREEN UGR272907 Ring Light 12-inch Kit,UGR-003059,UGREEN,1408.67,R-061016,Storage,101,WH-WEST,2024-07-07T00:00:00
RET_003028,Spigen SPI269807 Wall Mount 55-inch,SPI-003028,Spigen,2718.56,R-056637,Smart Home,34,WH-WEST,2024-01-05T00:00:00
RET_001459,INIU INI112907 HDMI Cable 6ft,INI-001459,INIU,1372.39,R-092016,Appliances,48,WH-EAST,2024-02-19T00:00:00
RET_001710,UGREEN UGR138007 Headphone Stand Wood,UGR-001710,UGREEN,3065.17,R-063387,Networking,42,WH-WEST,2024-12-20T00:00:00
RET_001571,StarTech STA124107 Surge Protector 12-Outlet,STA-001571,StarTech,982.43,R-037368,Audio,2,WH-EAST,2024-04-18T00:00:00
RET_003505,Sabrent SAB317507 HDMI Switch 3x1,SAB-003505,Sabrent,2270.89,R-062111,Networking,194,WH-NORTH,2024-02-14T00:00:00
RET_003437,ESR ESR310707 Audio Splitter 3.5mm,ESR-003437,ESR,2359.66,R-067648,Photography,45,WH-SOUTH,2024-02-04T00:00:00
RET_002635,JSAUX JSA230507 Wall Mount 55-inch,JSA-002635,JSAUX,621.93,R-092423,Gaming,162,WH-WEST,2025-04-12T00:00:00
RET_000977,Spigen SPI64707 MicroSD Card 512GB,SPI-000977,Spigen,2925.82,R-072953,Appliances,193,WH-WEST,2024-10-07T00:00:00
RET_000456,Kensington KEN12607 Camera Bag Backpack,KEN-000456,Kensington,476.84,R-036623,Gaming,64,WH-SOUTH,2025-01-16T00:00:00
RET_000546,ESR ESR21607 Surge Protector 12-Outlet,ESR-000546,ESR,2985.92,R-038150,Audio,96,WH-EAST,2024-10-13T00:00:00
RET_000481,JSAUX JSA15107 Tripod Mini Tabletop,JSA-000481,JSAUX,3228.90,R-048035,Gaming,44,WH-EAST,2025-07-20T00:00:00
RET_002569,UGREEN UGR223907 Phone Case Clear,UGR-002569,UGREEN,1087.37,R-011665,Office,102,WH-EAST,2025-05-14T00:00:00
RET_002718,UGREEN UGR238807 Trackpad Protector Film,UGR-002718,UGREEN,59.15,R-044614,Computing,125,WH-NORTH,2024-08-05T00:00:00
RET_001927,StarTech STA159707 USB Fan Mini Portable,STA-001927,StarTech,2911.65,R-084198,Office,59,WH-WEST,2024-06-30T00:00:00
RET_003685,HyperDrive HYP335507 Battery Pack AAA 12-Pack,HYP-003685,HyperDrive,943.12,R-093372,Smart Home,92,WH-EAST,2025-06-21T00:00:00
RET_002238,INSIGNIA INS190807 Battery Pack AAA 12-Pack,INS-002238,Insignia,69.36,R-060971,Smart Home,18,WH-SOUTH,2025-05-23T00:00:00
RET_001778,Nillkin NIL144807 Surge Protector 12-Outlet,NIL-001778,Nillkin,1182.35,R-085232,Computing,148,WH-WEST,2025-06-22T00:00:00
