inventory_id,description,manufacturer_code,brand_name,retail_price,store_sku,department,qty_on_hand,warehouse,last_received
RET_003378,Baseus BAS304807 Adapter USB-C to HDMI,BAS-003378,Baseus,2787.76,R-068600,Networking,84,WH-NORTH,2025-08-09T00:00:00
RET_001739,StarTech STA140907 USB-A to USB-C Cable,STA-001739,StarTech,1234.88,R-093743,Audio,55,WH-WEST,2024-11-28T00:00:00
RET_002605,Monoprice MON227507 Audio Splitter 3.5mm,MON-002605,Monoprice,3052.10,R-044271,Storage,127,WH-CENTRAL,2025-08-23T00:00:00
RET_003517,Targus TAR318707 USB Flash Drive 64GB,TAR-003517,Targus,2381.51,R-071558,Office,51,WH-EAST,2024-12-19T00:00:00
RET_002499,Insignia INS216907 Desk Mat Large,INS-002499,Insignia,2746.39,R-093371,Networking,145,WH-CENTRAL,2024-08-13T00:00:00
RET_001905,INIU INI157507 Wrist Rest Keyboard,INI-001905,INIU,1032.46,R-059814,Office,117,WH-EAST,2024-04-14T00:00:00
RET_001104,Spigen SPI77407 Audio Interface USB-C 2-Channel,SPI-001104,Spigen,772.94,R-049064,Office,185,WH-WEST,2025-02-02T00:00:00
RET_001347,Twelve South TWE101707 USB-A to USB-C Cable,TWE-001347,Twelve South,2447.00,R-091687,Gaming,157,WH-CENTRAL,2024-10-15T00:00:00
RET_000505,Baseus BAS17507 Laptop Sleeve 15-inch,BAS-000505,Baseus,3302.63,R-021834,Gaming,117,WH-NORTH,2024-12-13T00:00:00
RET_000353,JETech JET2307 Keyboard Cover Silicone,JET-000353,JETech,2562.96,R-022561,Gaming,40,WH-CENTRAL,2025-02-17T00:00:00
RET_000528,StarTech STA19807 Compressed Air Duster 2-Pack,STA-000528,StarTech,1780.51,R-062460,Office,27,WH-EAST,2024-11-30T00:00:00
RET_000607,Monoprice MON27707 Adapter USB-C to HDMI,MON-000607,Monoprice,3424.00,R-082379,Photography,75,WH-CENTRAL,2024-02-16T00:00:00
RET_000500,Nillkin NIL17007 Bluetooth Audio Transmitter,NIL-000500,Nillkin,305.82,R-053716,Storage,94,WH-WEST,2024-12-16T00:00:00
RET_002829,Twelve South TWE249907 Phone Mount Desk,TWE-002829,Twelve South,3258.31,R-039789,Networking,61,WH-EAST,2025-05-17T00:00:00
RET_002109,Kensington KEN177907 Surge Protector 12-Outlet,KEN-002109,Kensington,2448.25,R-024798,Office,95,WH-SOUTH,2025-03-15T00:00:00
RET_003812,SABRENT SAB348207 Docking Station USB-C Triple Display,SAB-003812,Sabrent,1492.19,R-010000,Gaming,157,WH-WEST,2025-08-08T00:00:00
RET_002297,Monoprice MON196707 Laptop Cooling Pad 17-inch,MON-002297,Monoprice,1933.89,R-038286,Photography,180,WH-WEST,2025-02-28T00:00:00
RET_001380,Satechi SAT105007 Ring Light 12-inch Kit,SAT-001380,Satechi,2563.28,R-093896,Office,184,WH-SOUTH,2024-08-14T00:00:00
RET_002584,Plugable PLU225407 Stylus Pen iPad,PLU-002584,Plugable,621.02,R-080656,Smart Home,51,WH-NORTH,2024-08-25T00:00:00
RET_002516,HyperDrive HYP218607 Tablet Case Folio,HYP-002516,HyperDrive,1667.89,R-096772,Appliances,170,WH-EAST,2024-05-01T00:00:00
RET_000113,Sony InZone M9 27-inch 4K Gaming Monitor,SON-000113,Sony,1498.34,R-058959,Appliances,91,WH-WEST,2024-08-28T00:00:00
RET_000672,OtterBox OTT34207 Phone Mount Car Vent,OTT-000672,OtterBox,2741.62,R-023591,Office,185,WH-NORTH,2024-09-15T00:00:00
RET_001726,Tripp Lite TRI139607 Audio Interface USB-C 2-Channel,TRI-001726,Tripp Lite,2749.77,R-068252,Computing,146,WH-SOUTH,2024-09-10T00:00:00
RET_002095,ESR ESR176507 Phone Case Rugged,ESR-002095,ESR,2396.95,R-029988,Computing,122,WH-EAST,2025-01-15T00:00:00
RET_002544,Kensington KEN221407 USB Flash Drive 64GB,KEN-002544,Kensington,2083.88,R-047473,Appliances,47,WH-WEST,2024-02-12T00:00:00
RET_003504,INIU INI317407 Hub USB-C 7-in-1,INI-003504,INIU,456.65,R-014524,Networking,162,WH-CENTRAL,2024-07-08T00:00:00
RET_001266,ESR ESR93607 Wrist Rest Keyboard,ESR-001266,ESR,3490.49,R-069366,Audio,5,WH-SOUTH,2024-12-29T00:00:00
RET_002530,CABLE MATTERS CAB220007 USB Fan Mini Portable,CAB-002530,Cable Matters,1552.51,R-047592,Audio,171,WH-WEST,2025-05-19T00:00:00
RET_000374,AmazonBasics AMA4407 Laptop Sleeve 13-inch,AMA-000374,AmazonBasics,2843.12,R-019404,Photography,142,WH-CENTRAL,2024-02-08T00:00:00
RET_000824,SYNCWIRE SYN49407 Screen Protector Film,SYN-000824,Syncwire,1263.43,R-022555,Electronics,103,WH-CENTRAL,2025-06-01T00:00:00
RET_002113,Twelve South TWE178307 Adapter USB-C to HDMI,TWE-002113,Twelve South,1752.63,R-053954,Electronics,180,WH-WEST,2025-06-12T00:00:00
RET_001946,INIU INI161607 Battery Pack AA 8-Pack,INI-001946,INIU,1151.90,R-056728,Computing,21,WH-SOUTH,2024-11-03T00:00:00
RET_002500,Sabrent SAB217007 Adapter USB-C to HDMI,SAB-002500,Sabrent,3675.17,R-023751,Computing,193,WH-CENTRAL,2024-08-16T00:00:00
RET_002079,Dynex DYN174907 Velcro Strips 20-Pack,DYN-002079,Dynex,97.21,R-088585,Office,70,WH-SOUTH,2025-03-22T00:00:00
RET_002565,Sabrent SAB223507 SD Card 128GB,SAB-002565,Sabrent,355.59,R-016575,Office,43,WH-SOUTH,2025-02-20T00:00:00
RET_003426,Insignia INS309607 Hard Drive Case Shockproof,INS-003426,Insignia,2950.87,R-045978,Networking,164,WH-NORTH,2025-06-20T00:00:00
RET_003422,JETech JET309207 Screen Protector Glass,JET-003422,JETech,3877.61,R-094880,Smart Home,39,WH-WEST,2024-02-24T00:00:00
RET_000339,HyperDrive HYP0907 Ethernet Cat6 Cable 25ft,HYP-000339,HyperDrive,2877.95,R-037312,Electronics,35,WH-NORTH,2024-03-31T00:00:00
RET_002470,Belkin BEL214007 Wrist Rest Mouse,BEL-002470,Belkin,2818.64,R-092062,Photography,199,WH-NORTH,2024-07-06T00:00:00
RET_003483,JETech JET315307 TOSLINK Cable 3ft,JET-003483,JETech,3326.76,R-029139,Appliances,47,WH-SOUTH,2024-08-04T00:00:00
RET_002625,JSAUX JSA229507 XLR Cable 10ft,JSA-002625,JSAUX,1394.96,R-021419,Electronics,141,WH-WEST,2024-05-26T00:00:00
RET_002240,Nillkin NIL191007 Battery Pack AA 8-Pack,NIL-002240,Nillkin,2200.30,R-082663,Computing,59,WH-CENTRAL,2024-02-06T00:00:00
RET_003366,ESR ESR303607 Camera Bag Sling,ESR-003366,ESR,2174.53,R-079249,Photography,85,WH-CENTRAL,2024-06-22T00:00:00
RET_001040,Insignia INS71007 Cable Management Box Large,INS-001040,Insignia,2924.19,R-061705,Networking,174,WH-NORTH,2024-10-10T00:00:00
RET_001469,Monoprice MON113907 Microphone Pop Filter,MON-001469,Monoprice,2379.68,R-078556,Appliances,105,WH-CENTRAL,2024-03-31T00:00:00
RET_001492,Kensington KEN116207 Laptop Backpack,KEN-001492,Kensington,2055.26,R-032927,Gaming,115,WH-EAST,2024-08-05T00:00:00
RET_001019,JSAUX JSA68907 Webcam Cover Slide 3-Pack,JSA-001019,JSAUX,3094.36,R-034340,Photography,174,WH-CENTRAL,2024-08-02T00:00:00
RET_000235,Razer BlackWidow V4 Pro Keyboard,RAZ-000235,Razer,2125.17,R-068900,Storage,66,WH-CENTRAL,2024-11-17T00:00:00
RET_000903,Dynex DYN57307 Screen Protector Glass,DYN-000903,Dynex,2286.13,R-026363,Gaming,197,WH-WEST,2024-02-10T00:00:00
RET_002777,Syncwire SYN244707 Thermal Paste 4g,SYN-002777,Syncwire,3413.64,R-033540,Gaming,96,WH-SOUTH,2024-08-28T00:00:00
RET_000413,SATECHI SAT8307 Tripod 60-inch Aluminum,SAT-000413,Satechi,2100.97,R-052054,Electronics,86,WH-NORTH,2024-07-31T00:00:00
RET_000305,NZXT Kraken Elite 360 AIO Cooler,NZX-000305,NZXT,3067.05,R-071281,Appliances,14,WH-EAST,2025-04-16T00:00:00
RET_001975,AmazonBasics AMA164507 RCA Cable 6ft,AMA-001975,AmazonBasics,2466.61,R-092502,Storage,160,WH-NORTH,2024-03-10T00:00:00
RET_000609,INIU INI27907 SD Card 128GB,INI-000609,INIU,156.66,R-071917,Appliances,69,WH-CENTRAL,2025-04-10T00:00:00
RET_001022,Cable Matters CAB69207 Keyboard Cover Silicone,CAB-001022,Cable Matters,1755.66,R-055102,Storage,52,WH-WEST,2024-07-30T00:00:00
RET_002439,Dynex DYN210907 Lightning Cable 3ft,DYN-002439,Dynex,288.31,R-013266,Gaming,174,WH-EAST,2024-05-28T00:00:00
RET_002844,Baseus BAS251407 Guitar Cable 20ft,BAS-002844,Baseus,1472.00,R-039694,Smart Home,102,WH-CENTRAL,2024-10-03T00:00:00
RET_003632,Cable Matters CAB330207 Cable Management Box Small,CAB-003632,Cable Matters,3407.74,R-078475,Smart Home,124,WH-CENTRAL,2024-06-15T00:00:00
RET_003019,JETech JET268907 Adapter Lightning to USB-C,JET-003019,JETech,1536.59,R-013257,Smart Home,131,WH-WEST,2024-05-31T00:00:00
RET_001036,Spigen SPI70607 Rechargeable Battery Kit,SPI-001036,Spigen,165.43,R-016196,Photography,124,WH-SOUTH,2024-12-29T00:00:00
RET_002482,CalDigit CAL215207 Hub USB-C 4-Port,CAL-002482,CalDigit,3354.30,R-093554,Storage,24,WH-WEST,2025-01-26T00:00:00
RET_002444,HyperDrive HYP211407 Surge Protector 12-Outlet,HYP-002444,HyperDrive,2355.34,R-061243,Networking,30,WH-NORTH,2025-03-03T00:00:00
RET_000278,Sonos Port Streaming Component,SON-000278,Sonos,1656.48,R-084605,Appliances,105,WH-WEST,2024-07-12T00:00:00
RET_001256,Kensington KEN92607 SD Card 128GB,KEN-001256,Kensington,1993.19,R-094582,Electronics,164,WH-SOUTH,2024-05-13T00:00:00
RET_003737,TWELVE SOUTH TWE340707 SD Card 128GB,TWE-003737,Twelve South,567.54,R-023726,Audio,46,WH-SOUTH,2025-03-06T00:00:00
RET_003756,DYNEX DYN342607 Phone Case Clear,DYN-003756,Dynex,481.69,R-015394,Photography,162,WH-SOUTH,2024-02-22T00:00:00
RET_002038,CalDigit CAL170807 Desk Lamp LED USB,CAL-002038,CalDigit,2462.13,R-017870,Electronics,156,WH-EAST,2025-06-27T00:00:00
RET_000955,Plugable PLU62507 DisplayPort Cable 6ft,PLU-000955,Plugable,792.00,R-030663,Computing,50,WH-EAST,2024-01-29T00:00:00
RET_002111,Sabrent SAB178107 Hard Drive Case Shockproof,SAB-002111,Sabrent,2507.00,R-078703,Networking,55,WH-CENTRAL,2024-01-19T00:00:00
RET_002317,SABRENT SAB198707 Audio Interface USB-C 2-Channel,SAB-002317,Sabrent,663.16,R-069372,Office,75,WH-SOUTH,2024-10-02T00:00:00
RET_000041,Samsung T7 Shield 2TB Portable SSD,SAM-000041,Samsung,2257.97,R-043359,Smart Home,143,WH-NORTH,2024-04-06T00:00:00
RET_002074,Mophie MOP174407 Laptop Cooling Pad 15-inch,MOP-002074,Mophie,901.87,R-022400,Storage,130,WH-EAST,2024-07-14T00:00:00
RET_001752,JSAUX JSA142207 Surge Protector 12-Outlet,JSA-001752,JSAUX,302.80,R-019890,Office,152,WH-SOUTH,2024-09-12T00:00:00
RET_002042,Spigen SPI171207 Microphone Pop Filter,SPI-002042,Spigen,2462.90,R-092219,Smart Home,108,WH-WEST,2024-07-08T00:00:00
RET_001388,StarTech STA105807 Headphone Stand Aluminum,STA-001388,StarTech,3286.23,R-053394,Computing,106,WH-NORTH,2024-07-01T00:00:00
RET_001713,AmazonBasics AMA138307 Docking Station USB-C Triple Display,AMA-001713,AmazonBasics,1929.26,R-021616,Photography,69,WH-CENTRAL,2025-05-18T00:00:00
RET_002841,JSAUX JSA251107 Extension Cord 10ft,JSA-002841,JSAUX,2880.26,R-068043,Storage,74,WH-WEST,2024-07-25T00:00:00
RET_000671,JETECH JET34107 SD Card 128GB,JET-000671,JETech,1020.94,R-044694,Audio,89,WH-NORTH,2025-05-22T00:00:00
RET_000627,JETech JET29707 TOSLINK Cable 3ft,JET-000627,JETech,1159.91,R-013186,Appliances,182,WH-NORTH,2024-01-26T00:00:00
RET_002857,HyperDrive HYP252707 Bluetooth Receiver,HYP-002857,HyperDrive,3503.97,R-055270,Photography,41,WH-CENTRAL,2025-07-08T00:00:00
RET_001196,JETech JET86607 DisplayPort Cable 6ft,JET-001196,JETech,3353.35,R-048021,Photography,143,WH-WEST,2025-05-08T00:00:00
RET_001305,Belkin BEL97507 Tripod 60-inch Aluminum,BEL-001305,Belkin,466.14,R-031583,Electronics,37,WH-CENTRAL,2024-09-20T00:00:00
RET_002433,Satechi SAT210307 Phone Case Rugged,SAT-002433,Satechi,1610.18,R-071098,Networking,18,WH-NORTH,2024-06-12T00:00:00
RET_003153,Monoprice MON282307 RCA Cable 6ft,MON-003153,Monoprice,2602.13,R-066621,Office,84,WH-NORTH,2024-02-11T00:00:00
RET_001335,Spigen SPI100507 Laptop Stand Adjustable,SPI-001335,Spigen,1124.81,R-067430,Storage,54,WH-WEST,2024-10-25T00:00:00
RET_003260,Mophie MOP293007 Green Screen Backdrop 5x7ft,MOP-003260,Mophie,2774.08,R-088079,Storage,37,WH-EAST,2025-04-29T00:00:00
RET_003263,Nillkin NIL293307 Velcro Strips 20-Pack,NIL-003263,Nillkin,357.53,R-043117,Storage,98,WH-WEST,2025-05-08T00:00:00
RET_002846,Mophie MOP251607 Bluetooth Receiver,MOP-002846,Mophie,2524.57,R-066813,Office,135,WH-EAST,2024-08-15T00:00:00
RET_002076,Cable Matters CAB174607 Compressed Air Duster 2-Pack,CAB-002076,Cable Matters,3495.94,R-033036,Photography,37,WH-EAST,2024-07-22T00:00:00
RET_002640,SABRENT SAB231007 Audio Splitter 3.5mm,SAB-002640,Sabrent,2752.00,R-098237,Appliances,149,WH-CENTRAL,2024-06-03T00:00:00
RET_000013,Apple AirPods Pro 2nd Gen USB-C,APP-000013,Apple,2698.54,R-075289,Appliances,184,WH-CENTRAL,2024-07-03T00:00:00
RET_002066,OtterBox OTT173607 Keyboard Cover Silicone,OTT-002066,OtterBox,2687.28,R-092136,Audio,65,WH-SOUTH,2025-02-13T00:00:00
RET_003608,Cable Matters CAB327807 Green Screen Backdrop 5x7ft,CAB-003608,Cable Matters,2148.59,R-082821,Smart Home,171,WH-CENTRAL,2025-06-16T00:00:00
RET_002709,CalDigit CAL237907 Monitor Arm Dual,CAL-002709,CalDigit,1971.03,R-028248,Computing,132,WH-NORTH,2025-07-02T00:00:00
RET_001724,AmazonBasics AMA139407 Phone Case Rugged,AMA-001724,AmazonBasics,2539.10,R-057630,Computing,46,WH-CENTRAL,2025-03-03T00:00:00
RET_002906,StarTech STA257607 Tablet Stand Foldable,STA-002906,StarTech,2749.58,R-067927,Smart Home,171,WH-SOUTH,2025-05-12T00:00:00
RET_001039,OtterBox OTT70907 Green Screen Backdrop 5x7ft,OTT-001039,OtterBox,1650.07,R-053607,Electronics,194,WH-EAST,2025-06-07T00:00:00
RET_000576,OtterBox OTT24607 Tablet Stand Foldable,OTT-000576,OtterBox,3380.19,R-094641,Storage,182,WH-SOUTH,2025-05-06T00:00:00
RET_002897,JETech JET256707 Tablet Stand Foldable,JET-002897,JETech,1052.09,R-012230,Photography,46,WH-WEST,2024-05-06T00:00:00
RET_000644,UGREEN UGR31407 Audio Interface USB-C 2-Channel,UGR-000644,UGREEN,1236.74,R-068879,Appliances,141,WH-WEST,2024-01-19T00:00:00
RET_001980,StarTech STA165007 FM Transmitter Car,STA-001980,StarTech,2391.00,R-049230,Networking,157,WH-NORTH,2024-03-03T00:00:00
RET_001314,Targus TAR98407 Laptop Sleeve 15-inch,TAR-001314,Targus,2540.04,R-050178,Smart Home,181,WH-EAST,2024-01-26T00:00:00
RET_003305,Syncwire SYN297507 HDMI Cable 10ft,SYN-003305,Syncwire,496.12,R-076784,Photography,22,WH-NORTH,2025-01-09T00:00:00
RET_001557,Monoprice MON122707 Privacy Screen 15.6-inch,MON-001557,Monoprice,2975.85,R-093482,Smart Home,153,WH-EAST,2024-12-21T00:00:00
RET_002990,Syncwire SYN266007 Hub USB-C 4-Port,SYN-002990,Syncwire,3041.99,R-098229,Computing,183,WH-CENTRAL,2024-10-23T00:00:00
RET_002581,PNY PNY225107 Hub USB-C 4-Port,PNY-002581,PNY,1096.20,R-062456,Office,184,WH-CENTRAL,2024-01-11T00:00:00
RET_001758,AmazonBasics AMA142807 Camera Bag Backpack,AMA-001758,AmazonBasics,2898.55,R-087600,Storage,131,WH-WEST,2025-06-06T00:00:00
RET_000242,Razer Blade 14 Ryzen 9 RTX 4070,RAZ-000242,Razer,2367.35,R-010074,Networking,140,WH-SOUTH,2024-11-04T00:00:00
RET_000615,StarTech STA28507 Guitar Cable 20ft,STA-000615,StarTech,583.28,R-040578,Networking,78,WH-NORTH,2025-02-20T00:00:00
RET_001774,Nillkin NIL144407 Tablet Case Folio,NIL-001774,Nillkin,2543.59,R-090044,Smart Home,157,WH-CENTRAL,2024-05-26T00:00:00
RET_000471,OtterBox OTT14107 Compressed Air Duster 2-Pack,OTT-000471,OtterBox,169.80,R-078241,Gaming,148,WH-SOUTH,2024-10-18T00:00:00
RET_001714,ESR ESR138407 USB-A to USB-C Cable,ESR-001714,ESR,1827.45,R-020208,Networking,13,WH-NORTH,2024-09-20T00:00:00
RET_003026,Satechi SAT269607 Optical Audio Cable 6ft,SAT-003026,Satechi,932.42,R-014792,Audio,83,WH-NORTH,2024-02-16T00:00:00
RET_003490,JSAUX JSA316007 Laptop Sleeve 13-inch,JSA-003490,JSAUX,3135.35,R-056033,Office,123,WH-WEST,2025-04-25T00:00:00
RET_000762,Plugable PLU43207 RCA Cable 6ft,PLU-000762,Plugable,2828.44,R-015915,Audio,25,WH-CENTRAL,2025-03-13T00:00:00
RET_001819,Spigen SPI148907 Ring Light 12-inch Kit,SPI-001819,Spigen,43.48,R-044321,Appliances,35,WH-NORTH,2025-02-21T00:00:00
RET_001629,UGREEN UGR129907 HDMI Switch 3x1,UGR-001629,UGREEN,165.36,R-068866,Storage,45,WH-NORTH,2025-01-22T00:00:00
RET_002142,JETech JET181207 Bluetooth Audio Transmitter,JET-002142,JETech,1979.99,R-045669,Appliances,81,WH-SOUTH,2025-08-02T00:00:00
RET_002105,Monoprice MON177507 Banana Plug Connector 4-Pack,MON-002105,Monoprice,1646.97,R-072694,Office,79,WH-CENTRAL,2024-10-31T00:00:00
RET_000325,WD My Passport 2TB External HDD,WD-000325,WD,1386.73,R-081893,Electronics,36,WH-SOUTH,2024-01-02T00:00:00
RET_003734,ESR ESR340407 Rechargeable Battery Kit,ESR-003734,ESR,1552.18,R-091529,Electronics,112,WH-NORTH,2024-05-01T00:00:00
RET_001293,Targus TAR96307 Screen Protector Film,TAR-001293,Targus,2548.20,R-098783,Networking,132,WH-NORTH,2025-01-27T00:00:00
RET_001634,Cable Matters CAB130407 Power Strip 6-Outlet,CAB-001634,Cable Matters,2382.89,R-064446,Smart Home,198,WH-SOUTH,2025-01-12T00:00:00
RET_000996,Belkin BEL66607 Velcro Strips 20-Pack,BEL-000996,Belkin,1207.89,R-049925,Storage,53,WH-EAST,2024-05-10T00:00:00
RET_003594,Dynex DYN326407 Wall Mount 55-inch,DYN-003594,Dynex,228.50,R-036159,Smart Home,112,WH-CENTRAL,2024-09-02T00:00:00
RET_001543,Tripp Lite TRI121307 VGA to HDMI Adapter,TRI-001543,Tripp Lite,3113.51,R-018977,Storage,2,WH-NORTH,2025-02-12T00:00:00
RET_003016,Belkin BEL268607 HDMI Cable 6ft,BEL-003016,Belkin,193.80,R-042320,Smart Home,116,WH-CENTRAL,2024-08-26T00:00:00
RET_000109,SONY DualSense Edge Controller,SON-000109,Sony,3685.68,R-068541,Computing,143,WH-EAST,2024-11-21T00:00:00
RET_003374,Baseus BAS304407 Extension Cord 10ft,BAS-003374,Baseus,3043.04,R-020826,Appliances,113,WH-EAST,2025-04-04T00:00:00
RET_003169,Syncwire SYN283907 Trackpad Protector Film,SYN-003169,Syncwire,411.36,R-024671,Appliances,61,WH-NORTH,2024-02-16T00:00:00
RET_000845,Sabrent SAB51507 Velcro Strips 20-Pack,SAB-000845,Sabrent,1152.23,R-094983,Electronics,81,WH-EAST,2025-05-08T00:00:00
RET_002913,Monoprice MON258307 Extension Cord 10ft,MON-002913,Monoprice,863.04,R-091542,Storage,60,WH-WEST,2024-06-26T00:00:00
RET_001794,INIU INI146407 Cable Organizer Clips,INI-001794,INIU,1619.87,R-081171,Photography,36,WH-CENTRAL,2024-07-03T00:00:00
RET_001317,JSAUX JSA98707 Portable SSD Case,JSA-001317,JSAUX,1195.36,R-010974,Audio,175,WH-EAST,2024-07-09T00:00:00
RET_001042,Dynex DYN71207 USB-A to USB-C Cable,DYN-001042,Dynex,2474.27,R-019109,Office,81,WH-WEST,2024-09-24T00:00:00
RET_001681,Spigen SPI135107 Hub USB-C 4-Port,SPI-001681,Spigen,1992.62,R-096250,Photography,194,WH-NORTH,2024-07-26T00:00:00
RET_002276,ESR ESR194607 HDMI Switch 3x1,ESR-002276,ESR,648.39,R-046621,Computing,149,WH-WEST,2025-02-21T00:00:00
RET_002420,Baseus BAS209007 Cable Organizer Clips,BAS-002420,Baseus,3625.86,R-072448,Photography,124,WH-CENTRAL,2024-10-06T00:00:00
RET_003537,Sabrent SAB320707 Webcam Ring Light 10-inch,SAB-003537,Sabrent,3592.61,R-037524,Computing,158,WH-NORTH,2024-08-19T00:00:00
RET_000960,PNY PNY63007 USB Flash Drive 128GB,PNY-000960,PNY,3896.63,R-034926,Photography,161,WH-EAST,2025-04-28T00:00:00
RET_002997,Plugable PLU266707 Ethernet Cat6 Cable 50ft,PLU-002997,Plugable,2507.54,R-026052,Electronics,194,WH-EAST,2025-02-17T00:00:00
RET_003134,ESR ESR280407 Screen Protector Film,ESR-003134,ESR,2274.44,R-086485,Audio,173,WH-CENTRAL,2025-07-14T00:00:00
RET_002319,Twelve South TWE198907 Cable Management Box Small,TWE-002319,Twelve South,3054.36,R-025722,Networking,195,WH-SOUTH,2024-02-20T00:00:00
RET_001223,Tripp Lite TRI89307 Laptop Cooling Pad 15-inch,TRI-001223,Tripp Lite,2112.25,R-015467,Gaming,189,WH-EAST,2024-03-10T00:00:00
RET_000750,Syncwire SYN42007 Lightning Cable 3ft,SYN-000750,Syncwire,3088.22,R-066573,Electronics,165,WH-CENTRAL,2025-07-09T00:00:00
RET_001895,Twelve South TWE156507 Hard Drive Case Shockproof,TWE-001895,Twelve South,2114.91,R-065861,Office,163,WH-EAST,2025-03-21T00:00:00
RET_001803,Baseus BAS147307 Bluetooth Receiver,BAS-001803,Baseus,1040.16,R-066023,Networking,74,WH-EAST,2025-06-09T00:00:00
RET_003309,UGREEN UGR297907 Adapter USB-C to HDMI,UGR-003309,UGREEN,1481.88,R-077126,Electronics,93,WH-WEST,2024-01-16T00:00:00
RET_003576,Kensington KEN324607 Adapter Lightning to USB-C,KEN-003576,Kensington,2768.69,R-060564,Electronics,105,WH-SOUTH,2024-01-07T00:00:00
RET_002713,INIU INI238307 Microphone Boom Arm,INI-002713,INIU,2901.56,R-074414,Electronics,122,WH-CENTRAL,2024-08-11T00:00:00
RET_002214,Cable Matters CAB188407 HDMI Cable 6ft,CAB-002214,Cable Matters,995.57,R-051899,Smart Home,73,WH-WEST,2024-06-10T00:00:00
RET_000124,LG CineBeam HU710PW 4K Projector,LG-000124,LG,1779.86,R-085788,Smart Home,47,WH-WEST,2024-05-07T00:00:00
RET_000629,Dynex DYN29907 Battery Pack AA 8-Pack,DYN-000629,Dynex,3514.03,R-019497,Networking,2,WH-WEST,2024-11-23T00:00:00
RET_001302,Belkin BEL97207 Webcam Ring Light 10-inch,BEL-001302,Belkin,2336.41,R-012331,Photography,148,WH-EAST,2025-01-14T00:00:00
RET_001535,ESR ESR120507 Banana Plug Connector 4-Pack,ESR-001535,ESR,1602.41,R-061500,Photography,46,WH-WEST,2025-02-17T00:00:00
RET_000164,Anker Nano II 65W USB-C Charger,ANK-000164,Anker,479.59,R-031499,Storage,36,WH-SOUTH,2024-02-10T00:00:00
RET_002229,INIU INI189907 Monitor Arm Dual,INI-002229,INIU,1485.41,R-052720,Storage,149,WH-WEST,2024-03-21T00:00:00
RET_000870,INIU INI54007 Webcam Cover Slide 3-Pack,INI-000870,INIU,3323.59,R-031230,Photography,14,WH-SOUTH,2024-12-08T00:00:00
RET_001655,Monoprice MON132507 FM Transmitter Car,MON-001655,Monoprice,3190.70,R-090000,Networking,123,WH-NORTH,2024-05-11T00:00:00
RET_003126,Baseus BAS279607 Laptop Cooling Pad 17-inch,BAS-003126,Baseus,3319.57,R-029892,Gaming,20,WH-SOUTH,2024-10-18T00:00:00
RET_001909,Twelve South TWE157907 Ethernet Cat6 Cable 50ft,TWE-001909,Twelve South,708.10,R-084935,Office,39,WH-WEST,2024-08-29T00:00:00
RET_000067,HP Spectre x360 16 i7 32GB,HP-000067,HP,2214.86,R-081858,Photography,76,WH-NORTH,2024-05-24T00:00:00
RET_002711,PNY PNY238107 Extension Cord 10ft,PNY-002711,PNY,342.36,R-017961,Appliances,49,WH-WEST,2024-08-12T00:00:00
RET_000591,Plugable PLU26107 Monitor Stand Riser,PLU-000591,Plugable,473.45,R-065372,Electronics,130,WH-CENTRAL,2024-02-08T00:00:00
RET_001167,Belkin BEL83707 USB Flash Drive 128GB,BEL-001167,Belkin,677.39,R-040318,Networking,32,WH-CENTRAL,2024-08-16T00:00:00
RET_000280,JBL Charge 5 Bluetooth Speaker,JBL-000280,JBL,1826.29,R-095467,Photography,9,WH-EAST,2025-07-31T00:00:00
RET_002672,Tripp Lite TRI234207 Wireless Charger Pad 15W,TRI-002672,Tripp Lite,2113.20,R-015924,Storage,142,WH-CENTRAL,2024-08-20T00:00:00
RET_000669,Nillkin NIL33907 Hub USB-C 4-Port,NIL-000669,Nillkin,2987.27,R-087100,Appliances,9,WH-NORTH,2024-02-29T00:00:00
RET_003552,Belkin BEL322207 Webcam Cover Slide 3-Pack,BEL-003552,Belkin,1231.03,R-056012,Smart Home,160,WH-NORTH,2025-02-11T00:00:00
RET_003160,Monoprice MON283007 Camera Bag Backpack,MON-003160,Monoprice,1301.43,R-072654,Gaming,63,WH-EAST,2025-04-24T00:00:00
RET_000332,Twelve South TWE0207 Anti-Glare Screen Film 27-inch,TWE-000332,Twelve South,3116.10,R-099816,Office,103,WH-CENTRAL,2024-06-03T00:00:00
RET_000755,Dynex DYN42507 SD Card 128GB,DYN-000755,Dynex,1243.18,R-081615,Smart Home,147,WH-CENTRAL,2025-05-13T00:00:00
RET_000220,Corsair Scimitar RGB Elite Mouse,COR-000220,Corsair,2080.82,R-079191,Storage,2,WH-WEST,2025-05-23T00:00:00
RET_001857,Cable Matters CAB152707 Stylus Pen Universal,CAB-001857,Cable Matters,164.41,R-052803,Computing,92,WH-CENTRAL,2024-07-10T00:00:00
RET_000418,Kensington KEN8807 MicroSD Card 256GB,KEN-000418,Kensington,476.52,R-073010,Networking,100,WH-WEST,2024-01-02T00:00:00
RET_001947,Satechi SAT161707 HDMI Splitter 1x4,SAT-001947,Satechi,2797.82,R-098256,Gaming,84,WH-SOUTH,2024-07-24T00:00:00
RET_001906,Sabrent SAB157607 Portable SSD Case,SAB-001906,Sabrent,1739.49,R-028121,Gaming,19,WH-SOUTH,2024-04-30T00:00:00
RET_001502,Nillkin NIL117207 Webcam Cover Slide 3-Pack,NIL-001502,Nillkin,3459.45,R-056501,Photography,178,WH-CENTRAL,2025-04-12T00:00:00
RET_002691,Monoprice MON236107 Surge Protector 12-Outlet,MON-002691,Monoprice,1989.49,R-099949,Storage,143,WH-EAST,2024-01-24T00:00:00
RET_001680,KENSINGTON KEN135007 Stylus Pen Universal,KEN-001680,Kensington,1176.78,R-017977,Electronics,37,WH-EAST,2024-11-19T00:00:00
RET_000560,Insignia INS23007 Desk Lamp LED USB,INS-000560,Insignia,3128.74,R-089803,Networking,67,WH-SOUTH,2025-06-25T00:00:00
RET_001868,Baseus BAS153807 Cable Management Box Large,BAS-001868,Baseus,227.38,R-068962,Networking,69,WH-EAST,2024-05-09T00:00:00
RET_003124,Insignia INS279407 MicroSD Card 512GB,INS-003124,Insignia,3050.96,R-086264,Computing,45,WH-CENTRAL,2024-02-21T00:00:00
RET_002667,OtterBox OTT233707 Microphone Boom Arm,OTT-002667,OtterBox,2695.85,R-073672,Gaming,141,WH-NORTH,2024-03-31T00:00:00
RET_000232,Razer DeathAdder V3 Pro Mouse,RAZ-000232,Razer,2917.05,R-040130,Office,171,WH-CENTRAL,2024-08-09T00:00:00
RET_003703,Tripp Lite TRI337307 Power Strip 6-Outlet,TRI-003703,Tripp Lite,898.44,R-029925,Office,55,WH-EAST,2025-08-20T00:00:00
RET_002811,JSAUX JSA248107 Power Strip 8-Outlet USB,JSA-002811,JSAUX,838.90,R-051368,Electronics,32,WH-SOUTH,2024-01-01T00:00:00
RET_003179,OtterBox OTT284907 Stylus Pen iPad,OTT-003179,OtterBox,1516.06,R-072089,Gaming,106,WH-EAST,2024-05-15T00:00:00
RET_000691,OtterBox OTT36107 FM Transmitter Car,OTT-000691,OtterBox,1660.71,R-091823,Smart Home,42,WH-EAST,2024-05-14T00:00:00
RET_001495,JETech JET116507 Velcro Strips 20-Pack,JET-001495,JETech,446.41,R-077221,Electronics,61,WH-CENTRAL,2024-11-13T00:00:00
RET_000002,APPLE MacBook Pro 14-inch M3 Pro,APP-000002,Apple,1385.05,R-076123,Computing,144,WH-SOUTH,2025-01-13T00:00:00
RET_001367,Targus TAR103707 Hard Drive Case Shockproof,TAR-001367,Targus,828.94,R-093737,Networking,115,WH-EAST,2025-06-16T00:00:00
RET_001521,Syncwire SYN119107 Hard Drive Case Shockproof,SYN-001521,Syncwire,1967.88,R-032280,Gaming,79,WH-WEST,2025-03-28T00:00:00
RET_001999,ESR ESR166907 TOSLINK Cable 3ft,ESR-001999,ESR,1021.42,R-014578,Smart Home,155,WH-WEST,2025-05-26T00:00:00
RET_002766,Belkin BEL243607 TOSLINK Cable 3ft,BEL-002766,Belkin,2008.99,R-086998,Photography,63,WH-CENTRAL,2024-08-04T00:00:00
RET_001007,Kensington KEN67707 Ethernet Cat6 Cable 25ft,KEN-001007,Kensington,2963.34,R-063166,Smart Home,126,WH-EAST,2024-07-17T00:00:00
RET_003384,StarTech STA305407 Compressed Air Duster 2-Pack,STA-003384,StarTech,3156.01,R-037266,Electronics,123,WH-EAST,2024-03-31T00:00:00
RET_000653,SYNCWIRE SYN32307 Wall Mount 65-inch,SYN-000653,Syncwire,3717.44,R-099406,Electronics,187,WH-WEST,2024-08-17T00:00:00
RET_000562,Twelve South TWE23207 Microphone Boom Arm,TWE-000562,Twelve South,3243.78,R-087235,Audio,191,WH-SOUTH,2024-03-12T00:00:00
