inventory_id,description,manufacturer_code,brand_name,retail_price,store_sku,department,qty_on_hand,warehouse,last_received
RET_002235,Nillkin NIL190507 Green Screen Backdrop 5x7ft,NIL-002235,Nillkin,2026.85,R-096527,Storage,197,WH-EAST,2024-04-07T00:00:00
RET_002661,Sabrent SAB233107 Power Strip 6-Outlet,SAB-002661,Sabrent,2148.81,R-083506,Gaming,77,WH-WEST,2024-06-19T00:00:00
RET_001341,PNY PNY101107 Battery Pack AAA 12-Pack,PNY-001341,PNY,1303.67,R-033679,Storage,6,WH-EAST,2024-07-18T00:00:00
RET_001993,MOPHIE MOP166307 Adapter USB-C to HDMI,MOP-001993,Mophie,1193.76,R-086022,Storage,149,WH-WEST,2025-06-05T00:00:00
RET_000106,Sony ZV-E10 II Vlog Camera Kit,SON-000106,Sony,1385.01,R-028690,Smart Home,96,WH-NORTH,2025-01-25T00:00:00
RET_002043,Mophie MOP171307 Tripod Mini Tabletop,MOP-002043,Mophie,276.96,R-023565,Storage,37,WH-SOUTH,2025-08-10T00:00:00
RET_000444,AmazonBasics AMA11407 USB Flash Drive 128GB,AMA-000444,AmazonBasics,1055.61,R-092572,Audio,107,WH-SOUTH,2024-08-09T00:00:00
RET_000542,Monoprice MON21207 Cable Management Box Small,MON-000542,Monoprice,2846.34,R-039493,Smart Home,123,WH-NORTH,2025-02-27T00:00:00
RET_003460,Dynex DYN313007 Keyboard Cover Silicone,DYN-003460,Dynex,948.86,R-068861,Audio,191,WH-CENTRAL,2024-12-27T00:00:00
RET_000861,StarTech STA53107 Cable Management Box Large,STA-000861,StarTech,1010.74,R-072139,Storage,8,WH-EAST,2024-05-17T00:00:00
RET_001012,Sabrent SAB68207 SD Card 256GB,SAB-001012,Sabrent,3521.00,R-014251,Networking,155,WH-EAST,2024-04-17T00:00:00
RET_003463,Monoprice MON313307 Adapter USB-C to HDMI,MON-003463,Monoprice,1505.69,R-049850,Photography,173,WH-SOUTH,2025-01-14T00:00:00
RET_000161,Anker PowerCore 26800mAh Power Bank,ANK-000161,Anker,652.04,R-029749,Storage,97,WH-EAST,2025-02-12T00:00:00
RET_000673,Satechi SAT34307 Hub USB-C 7-in-1,SAT-000673,Satechi,2488.67,R-048429,Gaming,85,WH-NORTH,2024-09-21T00:00:00
RET_003530,Nillkin NIL320007 Tripod 60-inch Aluminum,NIL-003530,Nillkin,2616.33,R-035927,Gaming,90,WH-SOUTH,2025-03-11T00:00:00
RET_003215,Insignia INS288507 Camera Lens Protector,INS-003215,Insignia,181.14,R-014434,Electronics,44,WH-SOUTH,2024-07-31T00:00:00
RET_003605,Nillkin NIL327507 Wall Mount 55-inch,NIL-003605,Nillkin,2956.01,R-083488,Gaming,86,WH-SOUTH,2025-06-17T00:00:00
RET_000807,Tripp Lite TRI47707 Wall Mount 55-inch,TRI-000807,Tripp Lite,3060.63,R-074039,Computing,40,WH-EAST,2025-01-07T00:00:00
RET_000422,CalDigit CAL9207 Car Charger Dual USB-C,CAL-000422,CalDigit,641.03,R-033894,Audio,23,WH-NORTH,2024-03-18T00:00:00
RET_000316,Crucial MX500 1TB SATA SSD,CRU-000316,Crucial,2938.25,R-038374,Audio,34,WH-WEST,2024-09-20T00:00:00
RET_002054,CalDigit CAL172407 XLR Cable 10ft,CAL-002054,CalDigit,1147.59,R-088901,Smart Home,7,WH-NORTH,2024-06-29T00:00:00
RET_001638,Mophie MOP130807 HDMI Switch 3x1,MOP-001638,Mophie,2871.68,R-031621,Storage,114,WH-SOUTH,2024-08-19T00:00:00
RET_001065,StarTech STA73507 Battery Pack AAA 12-Pack,STA-001065,StarTech,223.97,R-046337,Storage,20,WH-EAST,2024-06-01T00:00:00
RET_000386,HyperDrive HYP5607 SD Card 128GB,HYP-000386,HyperDrive,1605.35,R-028351,Smart Home,57,WH-CENTRAL,2025-06-08T00:00:00
RET_003710,Belkin BEL338007 Wall Mount 55-inch,BEL-003710,Belkin,983.97,R-055245,Computing,128,WH-WEST,2025-08-13T00:00:00
RET_002833,JETech JET250307 Battery Pack AAA 12-Pack,JET-002833,JETech,3211.14,R-027003,Audio,24,WH-SOUTH,2025-01-05T00:00:00
RET_001106,MOPHIE MOP77607 Phone Case Clear,MOP-001106,Mophie,2857.63,R-045935,Networking,117,WH-SOUTH,2025-01-13T00:00:00
RET_000780,StarTech STA45007 Adapter USB-C to USB-A,STA-000780,StarTech,1616.77,R-097334,Photography,100,WH-SOUTH,2024-07-04T00:00:00
RET_002485,AmazonBasics AMA215507 Laptop Cooling Pad 17-inch,AMA-002485,AmazonBasics,1414.77,R-082572,Networking,115,WH-CENTRAL,2025-03-11T00:00:00
RET_003187,INIU INI285707 Screen Protector Glass,INI-003187,INIU,480.45,R-079093,Audio,118,WH-CENTRAL,2024-04-15T00:00:00
RET_001030,Twelve South TWE70007 Monitor Arm Dual,TWE-001030,Twelve South,3953.05,R-028832,Networking,71,WH-EAST,2024-11-21T00:00:00
RET_000990,Targus TAR66007 Speaker Wire 50ft 14AWG,TAR-000990,Targus,3061.93,R-019404,Photography,54,WH-NORTH,2024-12-08T00:00:00
RET_001476,Mophie MOP114607 Hard Drive Case Shockproof,MOP-001476,Mophie,2212.34,R-081522,Smart Home,20,WH-SOUTH,2025-06-24T00:00:00
RET_002626,Satechi SAT229607 Laptop Sleeve 15-inch,SAT-002626,Satechi,3609.61,R-063758,Office,163,WH-NORTH,2024-04-06T00:00:00
RET_000289,JBL Quantum 910 Wireless Gaming Headset,JBL-000289,JBL,2249.00,R-056094,Storage,50,WH-EAST,2024-02-07T00:00:00
RET_000049,Samsung Freestyle 2nd Gen Projector,SAM-000049,Samsung,2701.60,R-080366,Electronics,28,WH-SOUTH,2025-06-12T00:00:00
RET_000764,INIU INI43407 SD Card 256GB,INI-000764,INIU,1411.44,R-075833,Networking,137,WH-WEST,2024-07-19T00:00:00
RET_003620,INIU INI329007 SD Card 256GB,INI-003620,INIU,1988.10,R-089254,Gaming,182,WH-SOUTH,2025-02-22T00:00:00
RET_003333,Baseus BAS300307 Ring Light 12-inch Kit,BAS-003333,Baseus,1217.23,R-077360,Storage,107,WH-SOUTH,2024-03-03T00:00:00
RET_002208,MOPHIE MOP187807 USB Fan Mini Portable,MOP-002208,Mophie,805.92,R-065348,Photography,139,WH-WEST,2024-08-23T00:00:00
RET_001117,HYPERDRIVE HYP78707 USB Flash Drive 128GB,HYP-001117,HyperDrive,257.61,R-066114,Computing,23,WH-EAST,2025-01-10T00:00:00
RET_002982,Sabrent SAB265207 Laptop Sleeve 15-inch,SAB-002982,Sabrent,2859.19,R-033851,Networking,191,WH-NORTH,2024-04-18T00:00:00
RET_001355,KENSINGTON KEN102507 Gimbal Smartphone 3-Axis,KEN-001355,Kensington,2542.33,R-027436,Gaming,4,WH-EAST,2024-05-05T00:00:00
RET_000729,Sabrent SAB39907 FM Transmitter Car,SAB-000729,Sabrent,3882.79,R-026746,Smart Home,3,WH-SOUTH,2025-03-22T00:00:00
RET_000324,WD My Passport 5TB External HDD,WD-000324,WD,2983.83,R-030035,Networking,69,WH-CENTRAL,2024-08-02T00:00:00
RET_000633,Plugable PLU30307 Power Strip 6-Outlet,PLU-000633,Plugable,234.82,R-042669,Electronics,191,WH-NORTH,2024-05-29T00:00:00
RET_002372,Kensington KEN204207 Laptop Cooling Pad 17-inch,KEN-002372,Kensington,2589.69,R-052398,Electronics,3,WH-SOUTH,2024-09-19T00:00:00
RET_001275,DYNEX DYN94507 Extension Cord 10ft,DYN-001275,Dynex,2954.41,R-093869,Audio,170,WH-WEST,2024-04-18T00:00:00
RET_002298,CalDigit CAL196807 SD Card 256GB,CAL-002298,CalDigit,2805.84,R-080797,Electronics,161,WH-SOUTH,2024-04-21T00:00:00
RET_001884,HyperDrive HYP155407 Anti-Glare Screen Film 27-inch,HYP-001884,HyperDrive,2596.79,R-070747,Audio,159,WH-NORTH,2024-04-05T00:00:00
RET_000875,Twelve South TWE54507 Rechargeable Battery Kit,TWE-000875,Twelve South,274.04,R-085856,Storage,200,WH-EAST,2024-02-11T00:00:00
RET_000437,PNY PNY10707 Cable Management Box Large,PNY-000437,PNY,662.86,R-052580,Audio,48,WH-NORTH,2025-07-04T00:00:00
RET_001892,Twelve South TWE156207 Battery Pack AAA 12-Pack,TWE-001892,Twelve South,241.13,R-050469,Computing,128,WH-SOUTH,2025-02-21T00:00:00
RET_002747,INIU INI241707 Anti-Glare Screen Film 27-inch,INI-002747,INIU,1890.08,R-087732,Electronics,26,WH-SOUTH,2025-04-23T00:00:00
RET_003380,Monoprice MON305007 Stylus Pen iPad,MON-003380,Monoprice,380.95,R-068312,Computing,131,WH-SOUTH,2025-05-01T00:00:00
RET_001675,OtterBox OTT134507 Stylus Pen Universal,OTT-001675,OtterBox,3382.61,R-097275,Office,164,WH-CENTRAL,2024-01-02T00:00:00
RET_003471,StarTech STA314107 Guitar Cable 20ft,STA-003471,StarTech,2576.90,R-086026,Smart Home,105,WH-CENTRAL,2024-12-15T00:00:00
RET_003257,Cable Matters CAB292707 Cable Management Box Large,CAB-003257,Cable Matters,2144.66,R-095291,Office,70,WH-NORTH,2025-04-18T00:00:00
RET_003345,Sabrent SAB301507 Camera Bag Sling,SAB-003345,Sabrent,2686.88,R-044588,Storage,42,WH-SOUTH,2025-06-23T00:00:00
RET_003782,Dynex DYN345207 Monitor Arm Single,DYN-003782,Dynex,2245.40,R-074721,Gaming,6,WH-WEST,2025-03-29T00:00:00
RET_000083,LENOVO ThinkPad X1 Carbon Gen 11 i7,LEN-000083,Lenovo,762.04,R-087317,Smart Home,165,WH-CENTRAL,2024-08-24T00:00:00
RET_003369,Twelve South TWE303907 Phone Case Clear,TWE-003369,Twelve South,3851.08,R-011210,Storage,76,WH-EAST,2024-07-29T00:00:00
RET_002306,Cable Matters CAB197607 Privacy Screen 13-inch,CAB-002306,Cable Matters,1535.51,R-078522,Office,93,WH-NORTH,2024-09-16T00:00:00
RET_000803,Plugable PLU47307 Monitor Arm Single,PLU-000803,Plugable,2267.82,R-075772,Office,100,WH-CENTRAL,2024-12-12T00:00:00
RET_003762,Spigen SPI343207 HDMI Cable 6ft,SPI-003762,Spigen,3424.67,R-048738,Office,107,WH-WEST,2024-08-06T00:00:00
RET_000958,Sabrent SAB62807 Lightning Cable 3ft,SAB-000958,Sabrent,1431.40,R-015113,Appliances,40,WH-CENTRAL,2025-04-05T00:00:00
RET_000256,Canon EOS R6 Mark II Body,CAN-000256,Canon,272.18,R-080614,Appliances,46,WH-WEST,2024-06-13T00:00:00
RET_000923,Monoprice MON59307 Keyboard Cover Silicone,MON-000923,Monoprice,1783.92,R-095849,Office,20,WH-NORTH,2024-02-29T00:00:00
RET_001606,SABRENT SAB127607 Ethernet Cat6 Cable 50ft,SAB-001606,Sabrent,2544.02,R-037591,Computing,24,WH-NORTH,2025-04-19T00:00:00
RET_000504,Targus TAR17407 Power Strip 6-Outlet,TAR-000504,Targus,2336.06,R-043210,Electronics,91,WH-CENTRAL,2024-08-09T00:00:00
RET_000924,TARGUS TAR59407 Optical Audio Cable 6ft,TAR-000924,Targus,2422.40,R-065708,Storage,56,WH-WEST,2024-08-05T00:00:00
RET_003515,Satechi SAT318507 Phone Mount Desk,SAT-003515,Satechi,3124.39,R-080556,Audio,163,WH-WEST,2024-09-20T00:00:00
RET_001699,Plugable PLU136907 Adapter Lightning to USB-C,PLU-001699,Plugable,1867.03,R-034994,Smart Home,40,WH-CENTRAL,2025-08-03T00:00:00
RET_003314,UGREEN UGR298407 Desk Mat Large,UGR-003314,UGREEN,1196.44,R-057025,Office,58,WH-CENTRAL,2024-10-28T00:00:00
RET_001834,UGREEN UGR150407 Tablet Stand Foldable,UGR-001834,UGREEN,1449.12,R-016162,Appliances,65,WH-CENTRAL,2025-03-03T00:00:00
RET_000066,Dell PowerEdge T150 Tower Server,DEL-000066,Dell,18.24,R-068591,Networking,83,WH-CENTRAL,2025-02-12T00:00:00
RET_002762,AmazonBasics AMA243207 Banana Plug Connector 4-Pack,AMA-002762,AmazonBasics,3436.73,R-016406,Audio,56,WH-WEST,2024-11-04T00:00:00
RET_001249,AmazonBasics AMA91907 Portable SSD Case,AMA-001249,AmazonBasics,2657.89,R-046601,Gaming,165,WH-EAST,2024-08-20T00:00:00
RET_002475,Cable Matters CAB214507 Monitor Arm Single,CAB-002475,Cable Matters,1917.11,R-080623,Storage,145,WH-EAST,2024-03-06T00:00:00
RET_001919,Spigen SPI158907 SD Card 256GB,SPI-001919,Spigen,3488.56,R-056626,Appliances,133,WH-SOUTH,2025-05-13T00:00:00
RET_001585,Targus TAR125507 Microphone Pop Filter,TAR-001585,Targus,756.79,R-084329,Networking,178,WH-EAST,2024-03-28T00:00:00
RET_003111,Cable Matters CAB278107 Wall Mount 55-inch,CAB-003111,Cable Matters,829.04,R-033276,Audio,135,WH-WEST,2024-05-03T00:00:00
RET_001233,AmazonBasics AMA90307 Desk Mat Large,AMA-001233,AmazonBasics,2607.10,R-065377,Storage,77,WH-CENTRAL,2024-11-23T00:00:00
RET_000153,Bose Smart Soundbar 900,BOS-000153,Bose,766.95,R-062620,Gaming,3,WH-CENTRAL,2025-08-19T00:00:00
RET_002408,Baseus BAS207807 USB-A to USB-C Cable,BAS-002408,Baseus,2256.81,R-031552,Office,21,WH-EAST,2025-05-08T00:00:00
RET_002246,OtterBox OTT191607 USB-A to USB-C Cable,OTT-002246,OtterBox,2747.09,R-028074,Electronics,123,WH-WEST,2024-12-11T00:00:00
RET_002871,MOPHIE MOP254107 Gimbal Smartphone 3-Axis,MOP-002871,Mophie,3171.38,R-084227,Smart Home,125,WH-EAST,2024-08-05T00:00:00
RET_002396,ESR ESR206607 Microfiber Cloth 6-Pack,ESR-002396,ESR,3295.32,R-040390,Appliances,51,WH-CENTRAL,2024-04-19T00:00:00
RET_002362,OtterBox OTT203207 Webcam Ring Light 10-inch,OTT-002362,OtterBox,3082.73,R-021123,Office,6,WH-SOUTH,2025-04-07T00:00:00
RET_002471,Satechi SAT214107 Phone Case Clear,SAT-002471,Satechi,325.54,R-046106,Electronics,73,WH-WEST,2025-02-14T00:00:00
RET_001994,INIU INI166407 Audio Splitter 3.5mm,INI-001994,INIU,2122.00,R-078911,Office,52,WH-WEST,2024-01-04T00:00:00
RET_001363,Cable Matters CAB103307 Thermal Paste 4g,CAB-001363,Cable Matters,2944.32,R-024240,Computing,160,WH-EAST,2025-04-10T00:00:00
RET_000858,Tripp Lite TRI52807 Laptop Backpack,TRI-000858,Tripp Lite,3213.79,R-029251,Office,48,WH-NORTH,2024-05-07T00:00:00
RET_002688,HyperDrive HYP235807 Monitor Stand Riser,HYP-002688,HyperDrive,1438.46,R-019792,Photography,196,WH-NORTH,2025-07-12T00:00:00
RET_003686,Nillkin NIL335607 USB-C Cable 10ft,NIL-003686,Nillkin,2903.02,R-015630,Gaming,117,WH-WEST,2024-04-05T00:00:00
RET_003760,StarTech STA343007 Tablet Case Folio,STA-003760,StarTech,2372.51,R-049611,Gaming,146,WH-EAST,2024-07-05T00:00:00
RET_002380,ESR ESR205007 Monitor Arm Dual,ESR-002380,ESR,3181.72,R-093405,Appliances,22,WH-CENTRAL,2024-08-08T00:00:00
RET_000462,StarTech STA13207 HDMI Cable 6ft,STA-000462,StarTech,911.71,R-010382,Computing,61,WH-NORTH,2025-07-14T00:00:00
RET_002272,Dynex DYN194207 TOSLINK Cable 3ft,DYN-002272,Dynex,3190.06,R-017882,Computing,63,WH-SOUTH,2024-07-01T00:00:00
RET_002092,StarTech STA176207 Desk Lamp LED USB,STA-002092,StarTech,2115.11,R-066389,Office,141,WH-EAST,2024-12-15T00:00:00
RET_003277,JSAUX JSA294707 Laptop Stand Adjustable,JSA-003277,JSAUX,2071.83,R-081793,Electronics,94,WH-SOUTH,2024-03-19T00:00:00
RET_001062,Tripp Lite TRI73207 Screen Protector Film,TRI-001062,Tripp Lite,1009.49,R-083127,Networking,99,WH-EAST,2024-12-31T00:00:00
RET_002771,JETECH JET244107 Laptop Stand Adjustable,JET-002771,JETech,2760.06,R-051078,Photography,41,WH-NORTH,2024-04-25T00:00:00
RET_003613,Plugable PLU328307 USB Flash Drive 128GB,PLU-003613,Plugable,2396.55,R-012766,Networking,7,WH-SOUTH,2024-09-05T00:00:00
RET_002055,ESR ESR172507 Battery Pack AAA 12-Pack,ESR-002055,ESR,1545.76,R-086412,Electronics,107,WH-NORTH,2025-08-12T00:00:00
RET_000003,Apple MacBook Pro 16-inch M3 Max,APP-000003,Apple,1220.40,R-036102,Networking,181,WH-EAST,2025-08-18T00:00:00
RET_003602,PNY PNY327207 Wrist Rest Keyboard,PNY-003602,PNY,2261.98,R-099347,Appliances,139,WH-CENTRAL,2024-12-21T00:00:00
RET_002868,Targus TAR253807 Gimbal Smartphone 3-Axis,TAR-002868,Targus,115.33,R-030403,Networking,36,WH-CENTRAL,2024-12-08T00:00:00
RET_002267,JSAUX JSA193707 HDMI Cable 6ft,JSA-002267,JSAUX,2305.48,R-069985,Office,83,WH-EAST,2024-09-23T00:00:00
RET_000579,Syncwire SYN24907 Optical Audio Cable 6ft,SYN-000579,Syncwire,976.38,R-088590,Photography,14,WH-NORTH,2024-03-27T00:00:00
RET_003540,Plugable PLU321007 Ring Light 12-inch Kit,PLU-003540,Plugable,398.17,R-095408,Gaming,176,WH-WEST,2024-04-18T00:00:00
RET_001652,Sabrent SAB132207 HDMI Cable 6ft,SAB-001652,Sabrent,4186.37,R-066057,Storage,12,WH-SOUTH,2025-08-12T00:00:00
RET_000738,Dynex DYN40807 Wall Mount 55-inch,DYN-000738,Dynex,1532.06,R-068898,Office,24,WH-NORTH,2025-06-25T00:00:00
RET_001689,Mophie MOP135907 Privacy Screen 15.6-inch,MOP-001689,Mophie,605.04,R-090150,Office,196,WH-SOUTH,2025-07-30T00:00:00
RET_002347,Tripp Lite TRI201707 Stylus Pen iPad,TRI-002347,Tripp Lite,751.36,R-011351,Electronics,71,WH-EAST,2024-11-07T00:00:00
RET_002541,Dynex DYN221107 USB Fan Mini Portable,DYN-002541,Dynex,1889.59,R-038375,Computing,6,WH-NORTH,2024-02-23T00:00:00
RET_002084,PNY PNY175407 Phone Case Rugged,PNY-002084,PNY,2992.69,R-075970,Gaming,134,WH-CENTRAL,2024-01-31T00:00:00
RET_001113,UGREEN UGR78307 Webcam Cover Slide 3-Pack,UGR-001113,UGREEN,2006.37,R-079360,Smart Home,136,WH-WEST,2024-02-04T00:00:00
RET_003175,ESR ESR284507 Hub USB-C 7-in-1,ESR-003175,ESR,1395.49,R-097970,Electronics,168,WH-EAST,2024-09-08T00:00:00
RET_002702,CalDigit CAL237207 Phone Case Rugged,CAL-002702,CalDigit,2143.11,R-084914,Smart Home,153,WH-EAST,2025-02-21T00:00:00
RET_000199,Google Nest Cam Outdoor,GOO-000199,Google,1250.05,R-069175,Audio,42,WH-CENTRAL,2024-04-21T00:00:00
RET_003749,StarTech STA341907 Banana Plug Connector 4-Pack,STA-003749,StarTech,2643.75,R-093704,Networking,24,WH-WEST,2024-06-05T00:00:00
RET_002885,Plugable PLU255507 Laptop Backpack,PLU-002885,Plugable,1421.04,R-047929,Networking,7,WH-EAST,2025-04-12T00:00:00
RET_002776,Nillkin NIL244607 HDMI Cable 6ft,NIL-002776,Nillkin,3399.41,R-048457,Networking,82,WH-NORTH,2025-03-18T00:00:00
RET_001191,Nillkin NIL86107 Desk Mat Large,NIL-001191,Nillkin,2403.58,R-018471,Appliances,29,WH-SOUTH,2024-07-16T00:00:00
RET_000082,HP Z2 Tower G9 Workstation,HP-000082,HP,1337.74,R-016655,Computing,82,WH-CENTRAL,2024-12-11T00:00:00
RET_001737,Kensington KEN140707 Hub USB 3.0 4-Port,KEN-001737,Kensington,561.06,R-045600,Office,196,WH-EAST,2024-03-09T00:00:00
RET_001155,Plugable PLU82507 Audio Splitter 3.5mm,PLU-001155,Plugable,2007.38,R-093289,Computing,24,WH-NORTH,2024-12-20T00:00:00
RET_002937,Monoprice MON260707 Camera Lens Protector,MON-002937,Monoprice,1588.37,R-090740,Photography,90,WH-CENTRAL,2025-05-30T00:00:00
RET_000412,Tripp Lite TRI8207 Thermal Paste 4g,TRI-000412,Tripp Lite,1049.26,R-023478,Storage,24,WH-CENTRAL,2025-01-09T00:00:00
RET_002894,Syncwire SYN256407 Privacy Screen 15.6-inch,SYN-002894,Syncwire,2810.76,R-030296,Smart Home,148,WH-EAST,2025-03-15T00:00:00
RET_002629,SABRENT SAB229907 Ethernet Cat6 Cable 25ft,SAB-002629,Sabrent,1266.07,R-015110,Audio,55,WH-SOUTH,2025-07-06T00:00:00
RET_003453,SYNCWIRE SYN312307 SD Card 128GB,SYN-003453,Syncwire,1878.65,R-060538,Office,155,WH-SOUTH,2025-05-17T00:00:00
RET_003107,Insignia INS277707 HDMI Cable 6ft,INS-003107,Insignia,2462.85,R-038505,Appliances,129,WH-NORTH,2024-10-26T00:00:00
RET_001607,INIU INI127707 XLR Cable 10ft,INI-001607,INIU,1574.06,R-038259,Storage,106,WH-NORTH,2024-12-23T00:00:00
RET_001780,Twelve South TWE145007 Cable Management Box Large,TWE-001780,Twelve South,2982.84,R-070358,Photography,15,WH-SOUTH,2025-08-02T00:00:00
RET_003519,Twelve South TWE318907 Camera Bag Backpack,TWE-003519,Twelve South,3397.89,R-089483,Gaming,82,WH-SOUTH,2024-03-29T00:00:00
RET_002687,Satechi SAT235707 Docking Station USB-C Triple Display,SAT-002687,Satechi,2952.94,R-015715,Smart Home,73,WH-WEST,2025-07-25T00:00:00
RET_000534,INIU INI20407 USB-C Cable 6ft,INI-000534,INIU,3852.65,R-047714,Appliances,68,WH-WEST,2024-03-14T00:00:00
RET_002296,PNY PNY196607 Wall Mount 65-inch,PNY-002296,PNY,1151.95,R-084757,Storage,118,WH-NORTH,2025-02-03T00:00:00
RET_002830,HyperDrive HYP250007 Screen Protector Glass,HYP-002830,HyperDrive,3549.85,R-063216,Computing,25,WH-EAST,2024-01-23T00:00:00
RET_003399,Dynex DYN306907 Ring Light 12-inch Kit,DYN-003399,Dynex,198.64,R-066823,Appliances,69,WH-WEST,2024-03-15T00:00:00
RET_001021,Baseus BAS69107 Hub USB 3.0 4-Port,BAS-001021,Baseus,2315.68,R-040437,Networking,89,WH-CENTRAL,2024-11-23T00:00:00
RET_000181,Microsoft Surface Hub 2S 50-inch,MIC-000181,Microsoft,489.53,R-075056,Audio,134,WH-SOUTH,2025-06-19T00:00:00
RET_002742,Satechi SAT241207 Laptop Stand Adjustable,SAT-002742,Satechi,3775.88,R-077642,Gaming,101,WH-CENTRAL,2025-04-06T00:00:00
RET_003817,UGREEN UGR348707 Surge Protector 12-Outlet,UGR-003817,UGREEN,2338.31,R-064283,Office,76,WH-EAST,2025-08-22T00:00:00
RET_000730,UGREEN UGR40007 Camera Lens Protector,UGR-000730,UGREEN,1628.40,R-056972,Appliances,23,WH-CENTRAL,2024-08-24T00:00:00
RET_001213,Spigen SPI88307 Microfiber Cloth 6-Pack,SPI-001213,Spigen,2901.16,R-070799,Gaming,177,WH-CENTRAL,2025-06-20T00:00:00
RET_001150,BELKIN BEL82007 Rechargeable Battery Kit,BEL-001150,Belkin,919.20,R-047747,Computing,25,WH-WEST,2025-05-02T00:00:00
RET_001441,Kensington KEN111107 Compressed Air Duster 2-Pack,KEN-001441,Kensington,540.11,R-048577,Gaming,135,WH-CENTRAL,2025-01-15T00:00:00
RET_002407,NILLKIN NIL207707 Laptop Backpack,NIL-002407,Nillkin,2716.57,R-016174,Appliances,126,WH-NORTH,2024-11-05T00:00:00
RET_000007,Apple iPhone 15 Pro Max 512GB,APP-000007,Apple,2084.08,R-020876,Storage,86,WH-CENTRAL,2024-05-19T00:00:00
RET_002730,UGREEN UGR240007 SD Card 256GB,UGR-002730,UGREEN,2014.94,R-095556,Gaming,134,WH-CENTRAL,2025-07-28T00:00:00
RET_003815,CALDIGIT CAL348507 TOSLINK Cable 3ft,CAL-003815,CalDigit,3434.73,R-041822,Computing,19,WH-EAST,2025-02-07T00:00:00
RET_003358,JETech JET302807 Battery Pack AA 8-Pack,JET-003358,JETech,2981.89,R-019087,Office,111,WH-EAST,2024-06-19T00:00:00
RET_000597,Syncwire SYN26707 SD Card 128GB,SYN-000597,Syncwire,1041.34,R-098736,Photography,26,WH-SOUTH,2025-05-22T00:00:00
RET_003559,Mophie MOP322907 Lightning Cable 3ft,MOP-003559,Mophie,897.92,R-093877,Smart Home,172,WH-EAST,2025-07-24T00:00:00
RET_001926,Sabrent SAB159607 USB-A to USB-C Cable,SAB-001926,Sabrent,2071.19,R-012392,Photography,158,WH-WEST,2024-02-26T00:00:00
RET_000927,JSAUX JSA59707 Adapter USB-C to USB-A,JSA-000927,JSAUX,1617.62,R-098824,Smart Home,180,WH-WEST,2024-05-12T00:00:00
RET_003242,HyperDrive HYP291207 SD Card 128GB,HYP-003242,HyperDrive,2406.80,R-038379,Smart Home,35,WH-NORTH,2024-09-12T00:00:00
RET_000079,HP OfficeJet Pro 9125e All-in-One,HP-000079,HP,3225.19,R-045783,Networking,112,WH-CENTRAL,2025-03-15T00:00:00
RET_003680,Syncwire SYN335007 Screen Protector Film,SYN-003680,Syncwire,1834.42,R-023958,Gaming,15,WH-NORTH,2025-03-03T00:00:00
RET_001061,Tripp Lite TRI73107 Adapter USB-C to USB-A,TRI-001061,Tripp Lite,869.13,R-095449,Computing,178,WH-SOUTH,2025-08-01T00:00:00
RET_001068,AmazonBasics AMA73807 Adapter USB-C to USB-A,AMA-001068,AmazonBasics,2972.88,R-042733,Electronics,187,WH-CENTRAL,2025-06-17T00:00:00
RET_000331,INIU INI0107 Screen Protector Glass,INI-000331,INIU,1294.72,R-081387,Networking,160,WH-CENTRAL,2025-04-08T00:00:00
RET_000136,Logitech C270 HD Webcam,LOG-000136,Logitech,2039.23,R-017660,Audio,59,WH-NORTH,2025-01-10T00:00:00
RET_002163,Syncwire SYN183307 Battery Pack AA 8-Pack,SYN-002163,Syncwire,187.56,R-087914,Gaming,23,WH-EAST,2024-12-24T00:00:00
RET_002320,JETech JET199007 Phone Case Rugged,JET-002320,JETech,3188.99,R-078885,Appliances,77,WH-WEST,2024-08-09T00:00:00
RET_002820,Insignia INS249007 FM Transmitter Car,INS-002820,Insignia,2185.82,R-073488,Photography,117,WH-CENTRAL,2024-07-08T00:00:00
RET_001297,Insignia INS96707 Audio Splitter 3.5mm,INS-001297,Insignia,98.24,R-012359,Computing,56,WH-SOUTH,2024-02-02T00:00:00
RET_000293,SteelSeries Arctis Nova 7 Wireless Headset,STE-000293,SteelSeries,1270.94,R-076483,Electronics,196,WH-SOUTH,2025-05-14T00:00:00
RET_000014,Apple AirPods Max,APP-000014,Apple,3520.80,R-022917,Audio,94,WH-SOUTH,2024-02-25T00:00:00
RET_003562,AmazonBasics AMA323207 Laptop Stand Adjustable,AMA-003562,AmazonBasics,829.61,R-030551,Photography,7,WH-NORTH,2024-10-29T00:00:00
RET_001687,Satechi SAT135707 Stylus Pen iPad,SAT-001687,Satechi,3228.88,R-071232,Photography,89,WH-NORTH,2025-05-14T00:00:00
RET_001083,INIU INI75307 Laptop Backpack,INI-001083,INIU,2966.43,R-018472,Computing,183,WH-NORTH,2024-12-09T00:00:00
RET_002167,OtterBox OTT183707 SD Card 128GB,OTT-002167,OtterBox,671.65,R-079558,Computing,96,WH-NORTH,2024-03-16T00:00:00
RET_000603,INSIGNIA INS27307 Wrist Rest Mouse,INS-000603,Insignia,1684.36,R-025041,Audio,56,WH-NORTH,2024-05-10T00:00:00
RET_001768,Dynex DYN143807 Tablet Case Folio,DYN-001768,Dynex,1427.35,R-030831,Storage,82,WH-SOUTH,2024-12-20T00:00:00
RET_002451,Targus TAR212107 HDMI Cable 6ft,TAR-002451,Targus,30.39,R-025456,Office,142,WH-WEST,2024-03-16T00:00:00
RET_001101,Nillkin NIL77107 Compressed Air Duster 2-Pack,NIL-001101,Nillkin,1549.60,R-053318,Photography,57,WH-WEST,2024-11-03T00:00:00
RET_001187,Mophie MOP85707 USB-C Cable 10ft,MOP-001187,Mophie,899.53,R-058523,Storage,162,WH-WEST,2025-05-17T00:00:00
RET_002557,CALDIGIT CAL222707 Laptop Sleeve 13-inch,CAL-002557,CalDigit,506.66,R-025025,Electronics,194,WH-NORTH,2024-10-21T00:00:00
RET_001527,JSAUX JSA119707 Ring Light 12-inch Kit,JSA-001527,JSAUX,1758.40,R-035575,Audio,16,WH-EAST,2024-01-02T00:00:00
RET_001856,Tripp Lite TRI152607 HDMI Switch 3x1,TRI-001856,Tripp Lite,441.50,R-014449,Photography,46,WH-WEST,2024-11-02T00:00:00
RET_000710,Twelve South TWE38007 XLR Cable 10ft,TWE-000710,Twelve South,1186.97,R-047366,Appliances,192,WH-SOUTH,2025-03-14T00:00:00
RET_003202,SABRENT SAB287207 Surge Protector 12-Outlet,SAB-003202,Sabrent,1080.32,R-036393,Electronics,142,WH-WEST,2025-04-15T00:00:00
RET_000279,Sonos Ace Wireless Headphones,SON-000279,Sonos,3544.39,R-011619,Gaming,32,WH-WEST,2024-09-17T00:00:00
RET_001812,Dynex DYN148207 Adapter USB-C to USB-A,DYN-001812,Dynex,3044.12,R-034966,Audio,38,WH-EAST,2025-07-09T00:00:00
RET_001512,Insignia INS118207 Laptop Backpack,INS-001512,Insignia,2672.02,R-049631,Gaming,48,WH-CENTRAL,2024-10-15T00:00:00
RET_003325,Baseus BAS299507 Wall Mount 55-inch,BAS-003325,Baseus,2350.36,R-026102,Gaming,161,WH-CENTRAL,2025-07-05T00:00:00
RET_002802,CalDigit CAL247207 Wrist Rest Keyboard,CAL-002802,CalDigit,3476.33,R-059392,Networking,153,WH-WEST,2025-02-11T00:00:00
RET_001047,INIU INI71707 Microphone Pop Filter,INI-001047,INIU,1914.40,R-033729,Photography,106,WH-WEST,2024-11-11T00:00:00
RET_001203,Baseus BAS87307 Webcam Ring Light 10-inch,BAS-001203,Baseus,274.33,R-021142,Gaming,64,WH-EAST,2025-07-09T00:00:00
RET_001425,Sabrent SAB109507 Monitor Arm Single,SAB-001425,Sabrent,1938.71,R-043012,Office,95,WH-CENTRAL,2024-04-15T00:00:00
RET_003372,SATECHI SAT304207 Webcam Ring Light 10-inch,SAT-003372,Satechi,3743.94,R-012011,Networking,48,WH-EAST,2025-06-06T00:00:00
RET_001693,Plugable PLU136307 Tripod 60-inch Aluminum,PLU-001693,Plugable,708.92,R-024676,Computing,36,WH-NORTH,2025-05-11T00:00:00
RET_003161,TWELVE SOUTH TWE283107 Ring Light 12-inch Kit,TWE-003161,Twelve South,2449.10,R-046957,Photography,49,WH-SOUTH,2024-05-14T00:00:00
RET_003190,Spigen SPI286007 Hard Drive Case Shockproof,SPI-003190,Spigen,326.98,R-033919,Smart Home,160,WH-NORTH,2025-08-19T00:00:00
RET_000430,Satechi SAT10007 Wrist Rest Mouse,SAT-000430,Satechi,2112.36,R-078986,Appliances,151,WH-WEST,2024-03-08T00:00:00
RET_000574,BELKIN BEL24407 HDMI Switch 3x1,BEL-000574,Belkin,2514.43,R-029581,Appliances,116,WH-CENTRAL,2024-10-02T00:00:00
RET_000264,Canon PIXMA TR8620a All-in-One Printer,CAN-000264,Canon,2690.03,R-014360,Smart Home,10,WH-WEST,2024-09-10T00:00:00
RET_002770,AmazonBasics AMA244007 Hub USB-C 4-Port,AMA-002770,AmazonBasics,957.29,R-067956,Photography,2,WH-NORTH,2025-05-01T00:00:00
